PT,AU,BA,BE,GP,AF,BF,CA,TI,SO,SE,BS,LA,DT,CT,CY,CL,SP,HO,DE,ID,AB,C1,RP,EM,RI,OI,FU,FX,CR,NR,TC,Z9,U1,U2,PU,PI,PA,SN,EI,BN,J9,JI,PD,PY,VL,IS,PN,SU,SI,MA,BP,EP,AR,DI,D2,PG,WC,SC,GA,UT,PM,OA,HC,HP,DA,DC,EC,LC,CC,BC
J,"Liang, Y1",,,,"Liang, Yan",,,College Business English teaching in the context of multimedia network,INTERNATIONAL JOURNAL OF ELECTRICAL ENGINEERING EDUCATION,,,English,Article; Early Access,,,,,,Multimedia; network information technology; Business English; auxiliary teaching,SPEAKING,"With the advent of the Internet age, network information technology is rapidly entering college English classes, which fundamentally changes the mode of college English teaching. In college English classroom teaching mode, as a brand teaching form, College English multimedia network teaching environment has brought advantages to classroom teaching, but also brought about impacts on teaching concepts, teaching models, teaching methods and other aspects. There are some phenomena that are inconsistent with the reform model at the students, teachers and the environment. The balance of traditional English classroom teaching has been broken, which has affected the smooth progress of college business English classroom teaching mode reform. It is very important to analyze and resolve these imbalances and find ecological methods for optimizing university English education. In this context, the advent of multimedia-assisted education technology has provided better conditions for the implementation of Business English classroom education in universities. Multimedia-powered business English education allows teachers to create a better language learning environment in class more conveniently and quickly, helping students acquire grammar knowledge and achieve their educational objectives.","[Liang, Yan] LanZhou JiaoTong Univ, Sch Art & Design, Lanzhou 730070, Peoples R China","Liang, Y (corresponding author), LanZhou JiaoTong Univ, Sch Art & Design, Lanzhou 730070, Peoples R China.",liangyan@lzjtu.edu.cn,,,,,"Ampa A. T., 2015, ENGLISH LANG TEACH, V8, P56, DOI [10.5539/elt.v8n12p56, DOI 10.5539/ELT.V8N12P56; Armenteros M, 2017, EDUC INF TECHNOL, V22, P841, DOI 10.1007/s10639-015-9460-; Buckley P, 2019, J ORGAN END USER COM, V31, P22, DOI 10.4018/JOEUC.201901010; Chen N, 2017, IEEE WIREL COMMUN, V24, P46, DOI 10.1109/MWC.2017.1600139W; Chen Y., 2014, AMR, V926-930, P463; Chen YC, 2017, EURASIA J MATH SCI T, V13, P133, DOI 10.12973/eurasia.2017.00608; Eassa AM, 2018, PROGRAM COMPUT SOFT+, V44, P435, DOI 10.1134/S036176881901002; Fabisiak L, 2018, J ORGAN END USER COM, V30, P1, DOI 10.4018/JOEUC.201810010; Hwang WY, 2014, AUSTRALAS J EDUC TEC, V30, P50; Jin HY., 2014, AMR, V926-930, P456; Li GH, 2015, 2015 EIGHTH INTERNATIONAL CONFERENCE ON INTERNET COMPUTING FOR SCIENCE AND ENGINEERING (ICICSE), P259, DOI 10.1109/ICICSE.2015.5; Li JH, 2019, INT J ELEC ENG EDUC, DOI 10.1177/002072091989108; Ling LS, 2018, INT SEMIN APPL TECHN, V22, P3; Liu HC, 2018, J EDUC COMPUT RES, V55, P1053, DOI 10.1177/073563311769702; Liu Jing Hui, 2014, Applied Mechanics and Materials, V644-650, P5773, DOI 10.4028/www.scientific.net/AMM.644-650.577; Lou MS, 2017, INT J EMERG TECHNOL, V12, P119, DOI 10.3991/ijet.v12i01.648; Carrio-Pastor ML, 2015, ENGL TODAY, V31, P10, DOI 10.1017/S026607841400048; Lv ZH, 2021, IEEE T COMPUT SOC SY, V8, P1194, DOI 10.1109/TCSS.2020.301115; Lv ZH, 2021, ACM T MULTIM COMPUT, V17, DOI 10.1145/339129; Lv ZH, 2021, ACM T MULTIM COMPUT, V16, DOI 10.1145/339820; Lv ZH, 2020, IEEE INTERNET THINGS, V7, P5706, DOI 10.1109/JIOT.2019.294271; Lv ZH, 2020, NEURAL COMPUT APPL, V32, P9593, DOI 10.1007/s00521-019-04472-; Lydia EL, 2021, T EMERG TELECOMMUN T, V32, DOI 10.1002/ett.377; Mo JY., 2014, AMR, V926, P470; Muslem A, 2017, INT J INSTR, V10, P203, DOI 10.12973/iji.2017.10113; Nozari Ali Yazdanpanah, 2015, Acta Inform Med, V23, P29, DOI 10.5455/aim.2015.23.29-3; Sheng F, 2018, INT J EMERG TECHNOL, V13, P176, DOI 10.3991/ijet.v13i06.858; Tang Y, 2019, J INTELL FUZZY SYST, V37, P3197, DOI 10.3233/JIFS-17912; Tsai SB, 2015, PLOS ONE, V10, DOI 10.1371/journal.pone.012915; Tupe N, 2015, INT J INSTR, V8, P125, DOI 10.12973/iji.2015.8210; Wang R, 2018, IEEE T IND INFORM, V14, P1712, DOI 10.1109/TII.2017.278890; Xin Zhang, 2018, 2018 International Conference on Intelligent Transportation, Big Data & Smart City (ICITBS). Proceedings, P133, DOI 10.1109/ICITBS.2018.0004; Yang JC, 2021, IEEE T IND INFORM, V17, P2204, DOI 10.1109/TII.2020.299881; Yanping Fan, 2014, Applied Mechanics and Materials, V685, P512, DOI 10.4028/www.scientific.net/AMM.685.51; Yuan XH, 2018, COMPUT ELECTR ENG, V70, P813, DOI 10.1016/j.compeleceng.2017.12.02; Zhang YS, 2018, IEEE INTERNET THINGS, V5, P3442, DOI 10.1109/JIOT.2017.278173; Zhao K, 2014, ASIA-PAC EDUC RES, V23, P273, DOI 10.1007/s40299-013-0103-",37,0,0,22,38,SAGE PUBLICATIONS LTD,LONDON,"1 OLIVERS YARD, 55 CITY ROAD, LONDON EC1Y 1SP, ENGLAND",0020-7209,2050-4578,,INT J ELEC ENG EDUC,Int. J. Elec. Eng. Educ.,,,,,,,,,,,207209211007768.0,10.1177/00207209211007768,,14,"Education, Scientific Disciplines; Engineering, Electrical & Electronic",Education & Educational Research; Engineering,RW0AS,WOS:000646186800001,,,,,2022-07-14,0.00519180847995385,3.275681195948122e-05,0.08013109770570528,0.1374375644176643,0.09065963514025774
J,"Anand, R1;  Padmasuresh, L;  Muthukumar, P;  Sreeja, P;  Krishnakumar, V;  Ramesh, MV",,,,"Anand, R.; Padmasuresh, L.; Muthukumar, P.; Sreeja, P.; Krishnakumar, V; Ramesh, M., V",,,Harmonics control of three phase voltage source inverter with random carriers and modified reference,INTERNATIONAL JOURNAL OF ELECTRICAL ENGINEERING EDUCATION,,,English,Article; Early Access,,,,,,Voltage source inverter; harmonic spread factor; random pulse width modulation; linear feedback shift register,PERFORMANCE,"The Harmonics control of any inverters can be decided by the PWM incorporated for the switches. In recent years the carrier and reference modification based research is going on the inverter field. This paper suggests that the alteration of carriers and references of the three phase voltage source inverter enhance the ability to decrease the harmonic content.This enhanced realization deals with the carrier and reference modification arrangement for three phase voltage source inverter through amalgamating the boosted reference and random triangular carrier. The boosted reference is the addition of sine reference with injection of 1/3rd of reference amplitude (3fs) in the middle portion of the reference wave. i.e., Pi/3 to 2 Pi/3 and 4 Pi/3 to 5 Pi/3. The proposed PWM scheme use two carriers, one is Triangle wave and another one is inverted Triangle wave. The process of selecting the winning carrier among the two triangle carriers is purely based on the LFSR technique. The spectral quality of the induction motor drives has improved by the random carriers. The simulation and experimental values are proving the validity of the PWM method. The PWMs are generated by using parallel processing enabled FPGA processor.","[Anand, R.] Nehru Inst Engn & Technol, Dept EEE, Coimbatore, Tamil Nadu, India; [Padmasuresh, L.] Baselios Mathews II Coll Engn, Dept EEE, Sasthamkotta, Kerala, India; [Muthukumar, P.; Ramesh, M., V] Prasad V Potluri Siddhartha Inst Technol, Dept EEE, Vijayawada, Andhra Pradesh, India; [Sreeja, P.] KMEA Engn Coll, Dept EEE, Aluva, Kerala, India; [Krishnakumar, V] St Josephs Coll Engn, Dept EEE, Chennai, Tamil Nadu, India","Muthukumar, P (corresponding author), Prasad V Potluri Siddhartha Inst Technol, Dept EEE, Vijayawada, Andhra Pradesh, India.",muthukumarvlsi@gmail.com,"Paramasivan, Muthu kumar/D-8874-2018; vengadakrishnan, krishnakumar/AAH-8465-2020","Paramasivan, Muthu kumar/0000-0002-4430-2145; vengadakrishnan, krishnakumar/0000-0001-6319-5237; L, PADMA SURESH/0000-0001-8939-1113",,,"Aleem SHEA, 2019, IEEE ACCESS, V7, P100824, DOI 10.1109/ACCESS.2019.293083; Arulmozhiyal R, 2010, J POWER ELECTRON, V10, P65, DOI 10.6113/JPE.2010.10.1.06; Guzman-Ramirez E, 2015, INT J ELEC ENG EDUC, V52, P22, DOI 10.1177/002072091557123; Harrison CG, 1997, INT J ELEC ENG EDUC, V34, P370, DOI 10.1177/00207209970340040; Jacob T., 2016, INT C EM TECHN TREND, P1, DOI [10.1109/ICETT.2016.7873768, DOI 10.1109/ICETT.2016.7873768; Jeyashanthi J, 2020, CONTROL ENG APPL INF, V22, P6; Kim KS, 2009, IEEE T POWER ELECTR, V24, P192, DOI 10.1109/TPEL.2008.200661; Krishnakumar V, 2015, AUST J BASIC APPL SC, V9, P16; Lim YC, 2010, IEEE T POWER ELECTR, V25, P797, DOI 10.1109/TPEL.2009.203569; Marikkannan A, 2019, CONTROL ENG APPL INF, V21, P5; Muthukumar P, 2020, J POWER ELECTRON, V20, P479, DOI 10.1007/s43236-020-00034-; Sathik MAJ, 2017, ELECTR POW COMPO SYS, V45, P1001, DOI 10.1080/15325008.2017.131943; Shankar M, 2019, CONTROL ENG APPL INF, V21, P3",13,0,0,0,3,SAGE PUBLICATIONS LTD,LONDON,"1 OLIVERS YARD, 55 CITY ROAD, LONDON EC1Y 1SP, ENGLAND",0020-7209,2050-4578,,INT J ELEC ENG EDUC,Int. J. Elec. Eng. Educ.,,,,,,,,,,,20720921996599.0,10.1177/0020720921996599,,15,"Education, Scientific Disciplines; Engineering, Electrical & Electronic",Education & Educational Research; Engineering,RW0PU,WOS:000646227500001,,,,,2022-07-14,0.0018748197288722237,8.717591558465924e-05,0.011259819649550843,0.11688749536428307,0.010654811714440151
J,"Bian, F1;  Wang, XS",,,,"Bian, Fei; Wang, Xuansheng",,,The effect of big-data on the management of higher education in China and its countermeasures,INTERNATIONAL JOURNAL OF ELECTRICAL ENGINEERING EDUCATION,,,English,Article; Early Access,,,,,,Big-data; higher education management; influence; countermeasure,,"Nowadays, China has got into the era of big-data. In the background of big-data information era, the management of college students in China has undergone certain changes, and the trend of student management informationization is obvious. Universities are momentous places for cultivating talents. The student management work of universities directly affects the quality of talent training and affects the stability of colleges and universities (CAU). The internal structure and external environment faced by higher education are undergoing unprecedented profound changes, bringing many new situations, new problems and new challenges to the supervision of university students. Therefore, college education managers need to show solicitude for the impact of big-data technology on college education management (CEM) and propose corresponding countermeasures to raise the productivity of college education administration. This paper concentrates on the characteristics of big-data. On the basis of investigating the present situation and matters of the development of big-data education administration in CAU in China, this paper explores the countermeasures to raise the innovation of big-data education management (BDEM) in universities in China.","[Bian, Fei] Shenzhen Polytech, Dev & Planning Off, Inst Res Ctr, Shenzhen, Guangdong, Peoples R China; [Wang, Xuansheng] Shenzhen Inst Informat Technol, Sch Software Engn, Shenzhen 518057, Guangdong, Peoples R China","Wang, XS (corresponding author), Shenzhen Inst Informat Technol, Sch Software Engn, Shenzhen 518057, Guangdong, Peoples R China.",wangxs820111@163.com,,,Special Research Project on College Philosophy and Social Sciences in 2019 of the 13th Five-Year Plan for Educational Science in Guangdong Province [2019GXJK242]; Shenzhen Educational Science Planning Project in 2020 [ybzz20010]; Shenzhen Infrastructure Project [JCYJ20170306095959113],"The author(s) disclosed receipt of the following financial support for the research, authorship, and/or publication of this article: This work was supported by the Special Research Project on College Philosophy and Social Sciences in 2019 of the 13th Five-Year Plan for Educational Science in Guangdong Province (2019GXJK242); Shenzhen Educational Science Planning Project in 2020 (ybzz20010); Shenzhen Infrastructure Project (JCYJ20170306095959113).","Hu Y., 1999, PARTY GOVT FORUM, P4; Hua W., 2009, SUCCESS ED, P; Jia YC, 2019, INT J ELEC ENG EDUC, DOI 10.1177/002072091986741; Krishnaraj N, 2020, J REAL-TIME IMAGE PR, V17, P2097, DOI 10.1007/s11554-019-00879-; Lei XT, 2020, J KING SAUD UNIV SCI, V32, P207; Li H., 2017, CHINA NEW COMMUN, V1; Li JJ, 2017, EDUC RES EVAL, V23, P3, DOI 10.1080/13803611.2017.131179; Li Z, 2017, INTELLIGENCE, P15; Liu Q, 2014, STATE OWNED ENTERPRI, P3; Lv ZH, 2020, IEEE INTERNET THINGS, V7, P5706, DOI 10.1109/JIOT.2019.294271; Lv ZH, 2017, IEEE T IND INFORM, V13, P1891, DOI 10.1109/TII.2017.265020; Ma Xiaoping, 2014, Industry and Mine Automation, V40, P; Ponce P, 2019, INT J ELEC ENG EDUC, DOI 10.1177/002072091881600; Sheng X, 2019, INT J ELEC ENG EDUC, DOI 10.1177/002072091988423; Sun JL., 2017, HEILONGJIANG ED THE; Twigg P, 2018, INT J ELEC ENG EDUC, V55, P120, DOI 10.1177/002072091875625; Wang L., 2017, ELECT TECHNOL SOFTW, P20; Zhang Y, 2017, J JIAOZUO U, P11; Zhang Z, 2017, SCI TECHNOL INFORM, V15, P16; Zhihan L., 2020, IEEE T INTELL TRANSP, V8, P16335; Zhu L, 2017, J CHANGZHOU I INFORM, V16, P7",21,0,0,16,37,SAGE PUBLICATIONS LTD,LONDON,"1 OLIVERS YARD, 55 CITY ROAD, LONDON EC1Y 1SP, ENGLAND",0020-7209,2050-4578,,INT J ELEC ENG EDUC,Int. J. Elec. Eng. Educ.,,,,,,,,,,,207209211002076.0,10.1177/00207209211002076,,9,"Education, Scientific Disciplines; Engineering, Electrical & Electronic",Education & Educational Research; Engineering,RO5PM,WOS:000641096500001,,,,,2022-07-14,0.003028554946639746,7.245474048554014e-06,0.020102352638976143,0.12403849593932238,0.020021266914517607
J,"Gan, L1;  Wang, DY;  Wang, CC;  Xiao, D;  Zhang, M;  Wang, ZX;  Li, F",,,,"Gan, Lin; Wang, Daoyang; Wang, Cuicui; Xiao, Ding; Zhang, Mu; Wang, Zixuan; Li, Fang",,,Design and implementation of multimedia teaching platform for situational teaching of music appreciation course based on virtual reality,INTERNATIONAL JOURNAL OF ELECTRICAL ENGINEERING EDUCATION,,,English,Article; Early Access,,,,,,Music appreciation teaching; virtual reality; multimedia teaching platform,,"The main goal of music appreciation teaching is to cultivate students' correct aesthetics and teach them to acquire basic knowledge about music history and musical expression methods. However, traditional music teaching is often limited in conditions and abstract in content, making it difficult to achieve this teaching goal. For the purpose of achieving the teaching goal and effect, this paper mainly studies how to use the new teaching aids, namely virtual reality technology, to design and implement the multimedia teaching platform for the music appreciation course scenario teaching. Through the statistics of the students' music appreciation course and the feedback data collected by the questionnaire, the results show that the platform in this paper is helpful to arouse students' interest in music learning and promote their efficient and independent learning. The innovation of this article lies in the full application of virtual reality technology to music teaching appreciation classes, which enables the effective combination of virtual reality technology and music courses to play the role of virtual reality technology.","[Gan, Lin] Tianjin Univ, Sch Precis Instrument & Optoelect Engn, Tianjin, Peoples R China; [Wang, Daoyang] Hangzhou Normal Univ, Coll Educ, Hangzhou, Zhejiang, Peoples R China; [Wang, Daoyang] Anhui Normal Univ, Sch Educ Sci, Wuhu, Peoples R China; [Wang, Cuicui] Beijing Normal Univ, State Key Lab Cognit Neurosci & Learning, Beijing, Peoples R China; [Wang, Cuicui] Beijing Normal Univ, IDG McGovern Inst Brain Res, Beijing, Peoples R China; [Xiao, Ding] Beijing Film Acad, Sch Audio Visual Arts & Commun, Beijing, Peoples R China; [Zhang, Mu] Tianjin Univ, Coll Intelligence & Comp, Tianjin, Peoples R China; [Wang, Zixuan; Li, Fang] Beijing Normal Univ, Sch Arts & Commun, Beijing, Peoples R China","Zhang, M (corresponding author), Tianjin Univ, Coll Intelligence & Comp, Tianjin, Peoples R China.",sya@tju.edu.cn,,"Xiao, Ding/0000-0002-3380-9303",,,"Akintola KG., 2011, INT J MULTIMEDIA UBI, V6, P4; Belagra M, 2018, INT J ELEC ENG EDUC, V55, P293, DOI 10.1177/002072091877305; Chen M X., 2010, MOD DISTANCE ED RES, P1; Chen M Y, 2001, INF TECHNOL, P1; Chen YT, 2019, MATHEMATICS-BASEL, V7, DOI 10.3390/math701001; Ding ST, 2020, NEUROCOMPUTING, V398, P520, DOI 10.1016/j.neucom.2019.04.09; HU XQ, 2005, VIRTUAL REALITY TEC; Hu XY., 2003, CET CHINA ED TECHNOL, P2; Jiao YC, 2011, DIGITAL TECHNOL APPL, P10; Khmelevsky Y., 2011, P 16 W CAN C COMP ED, P1; Li J, 2002, INF TECHNOL ED PRIMA, P; Li L, 2011, SME MANAGE TECHNOL, P27; Li M., 2008, BEIJ HIGH TEACH AS; Li ZW., 2009, VOLKSWAGEN TECHNOL, P5; Liu XX., 2017, TECHNOL INNOVATION B, P3; Lv AY., 2011, DESIGN DEV VIRTUAL ; Pan ZQ., 2017, FARM STAFF, P14; Park SH, 2017, J ELECTRON MATER, V46, P848, DOI 10.1007/s11664-016-4972-; Popovic N, 2016, INT J ELEC ENG EDUC, V53, P357, DOI 10.1177/002072091663932; Por FP, 2012, PROCD SOC BEHV, V64, P584, DOI 10.1016/j.sbspro.2012.11.06; Qiu, VIRTUAL REALITY TEC; Tan JC, 2013, J GANSU ED, P7; Tascovici, 2011, C P E LEARN SOFTW ED, V7, P21; Wan SH, 2020, IEEE T MULTIMEDIA, V22, P1756, DOI 10.1109/TMM.2020.297657; Wei J, 2019, INVEST CLIN, V6; Xu D, 2003, PEOPLES MUSIC, P2; Yan HM, 2012, NEIJIANG SCI TECHNOL, P6; Yaron D, 2010, SCIENCE, V328, P584, DOI 10.1126/science.118243; Yuan YB, 2001, CHINA ELECTROCHEM ED, P2; Zhong Z X, 2001, TEACHER EXPO, P3; Zhu ZT, 2001, CHINA AUDIOVISCUAL E, P",31,0,0,16,41,SAGE PUBLICATIONS LTD,LONDON,"1 OLIVERS YARD, 55 CITY ROAD, LONDON EC1Y 1SP, ENGLAND",0020-7209,2050-4578,,INT J ELEC ENG EDUC,Int. J. Elec. Eng. Educ.,,,,,,,,,,,20720920986090.0,10.1177/0020720920986090,,16,"Education, Scientific Disciplines; Engineering, Electrical & Electronic",Education & Educational Research; Engineering,RO5OD,WOS:000641093000001,,,,,2022-07-14,0.004470723968849149,6.485153538840315e-07,0.03246284319683218,0.1246539388055945,0.03175636788651716
J,"Yao, L1;  Wang, RX",,,,"Yao, Lei; Wang, Ruixin",,,A magnetically controlled series compensation-fault current limiter,INTERNATIONAL JOURNAL OF ELECTRICAL ENGINEERING EDUCATION,,,English,Article; Early Access,,,,,,Magnetic-controlled reactor; air gap structure; fault current limiter; series compensation,,"This paper presents a magnetically controlled series compensation-fault current limiter (MCSC-FCL) which is composed of a magnetically controlled reactor (MCR) and a compensation capacitor. The device is improved from the traditional thyristor-controlled series compensation (TCSC), which has the characteristics of small output harmonics and simple control. The traditional saturated iron-core reactor is improved to increase the adjustable range of output reactance. During the fault, the MCR is connected to the grid alone to limit fault current; when the grid is normal, MCR and capacitor are used in series compensation mode. It effectively improves the utilization rate of the traditional current limiter MCR. In order to verify the effectiveness of the proposed MCSC-FCL, this paper analyzes the control characteristics of reactor models with different air gap structures by JMAG finite element analysis software, and verifies the voltage regulation characteristics and fault current limitation capabilities on MATLAB/Simulink platform.","[Yao, Lei; Wang, Ruixin] Univ Shanghai Sci & Technol, Dept Elect Engn, Shanghai 200093, Peoples R China","Yao, L (corresponding author), Univ Shanghai Sci & Technol, Dept Elect Engn, Shanghai 200093, Peoples R China.",yaolei_usst@126.com,,"Wang, Ruixin/0000-0002-6559-8352",National Natural Science Foundation of China [51707121],"The author(s) disclosed receipt of the following financial support for the research, authorship, and/or publication of this article: This research was funded by the National Natural Science Foundation of China, grant number is 51707121.","Adly AR, 2020, INT J ELEC POWER, V120, DOI 10.1016/j.ijepes.2020.10602; Adly AR, 2020, MEASUREMENT, V151, DOI 10.1016/j.measurement.2019.10715; Alam MS, 2018, ENERGIES, V11, DOI 10.3390/en1105102; Alves LF, 2019, INT J ELEC ENG EDUC, V56, P62, DOI 10.1177/002072091878745; Dimitrovski A, 2015, IEEE T POWER DELIVER, V30, P1708, DOI 10.1109/TPWRD.2015.240013; Linden J, 2019, ENERGIES, V12, DOI 10.3390/en1210182; Nakamura K, 2000, IEEE T MAGN, V36, P3565, DOI 10.1109/20.90889; Nakamura K, 2008, IEEE T MAGN, V44, P4107, DOI 10.1109/TMAG.2008.200286; Omar AI, 2019, ISA T, V95, P110, DOI 10.1016/j.isatra.2019.05.00; Shen HC, 2018, ENERGIES, V11, DOI 10.3390/en1112347; [姚磊 Yao Lei], 2013, [电网技术, Power System Technology], V37, P250; Yuan JX, 2020, HIGH VOLT, V5, P416, DOI 10.1049/hve.2019.004; Zhang JY., 2011, INT C APPL SUP EL DE, P1; Zhong Y., 2019, IEEE T MAGN, V55, P",14,0,0,1,7,SAGE PUBLICATIONS LTD,LONDON,"1 OLIVERS YARD, 55 CITY ROAD, LONDON EC1Y 1SP, ENGLAND",0020-7209,2050-4578,,INT J ELEC ENG EDUC,Int. J. Elec. Eng. Educ.,,,,,,,,,,,207209211002092.0,10.1177/00207209211002092,,13,"Education, Scientific Disciplines; Engineering, Electrical & Electronic",Education & Educational Research; Engineering,RO5WO,WOS:000641115000001,,,,,2022-07-14,0.002019036631093164,3.341882747568286e-09,0.00972741879178657,0.10448435898981376,0.009074946665556697
J,"Raczynski, M1",,,,"Raczynski, Michal",,,Remote laboratory classes in a COVID pandemic situation. Example of subjects: Microcontroller programming and electronic circuits,INTERNATIONAL JOURNAL OF ELECTRICAL ENGINEERING EDUCATION,,,English,Article; Early Access,,,,,,Remote teaching; microcontrollers; electronic systems; laboratory classes,,The article presents the possibility of conducting remote laboratory classes in subjects that require the use of specialized equipment (which the student does not have at home). The article is based on the example of classes in microcontrollers programming and electronic circuits. The methods with the use of simulation programs and an innovative approach enabling work on real equipment are presented. The solutions presented in the article were practically and successfully implemented in connection with the coronavirus pandemic in spring 2020 at the Faculty of Electrical Engineering of West Pomeranian University of Technology in Szczecin. A very important feature of the presented ideas is the possibility to adapt the already existing stationary solutions to remote work and use free applications. The characteristic feature of the presented ideas is also simplicity. These two features make it possible to implement remote learning quickly and at a low-cost. Classes conducted using the described system for a group of about 50 students were positively evaluated by them. Their opinions were also included in the article.,"[Raczynski, Michal] West Pomeranian Univ Technol, Fac Elect Engn, PL-70310 Szczecin, Poland","Raczynski, M (corresponding author), West Pomeranian Univ Technol, Fac Elect Engn, PL-70310 Szczecin, Poland.",michal.raczynski@zut.edu.pl,,"Raczynski, Michal/0000-0002-4106-6802",,,"Adami T. V., 2001, Telematics Applications in Automation and Robotics 2001 (TA 2001). Proceedings volume from the IFAC Conference, P47; Bjelica M, 2018, INT J ELEC ENG EDUC, V55, P79, DOI 10.1177/002072091775096; del Rio A., 2000, 30 ANN FRONT ED C B; Itagi M., 2015, INT J COMPUT INTERNE, V2; Lin HF, 2016, ADV SOC SCI EDUC HUM, V85, P; Rahman MZ, 2014, TLC, V11, P16; Swain N., 2011, AM SOC ENG E; Tang SS., 2014, ADV ENG EDUC, V4, pN; Uiterwijk CJM., 2007, IJIM, V192, P; Zine O, 2019, INT J ELEC ENG EDUC, V56, P3, DOI 10.1177/002072091877504",10,1,1,1,13,SAGE PUBLICATIONS LTD,LONDON,"1 OLIVERS YARD, 55 CITY ROAD, LONDON EC1Y 1SP, ENGLAND",0020-7209,2050-4578,,INT J ELEC ENG EDUC,Int. J. Elec. Eng. Educ.,,,,,,,,,,,207209211004219.0,10.1177/00207209211004219,,13,"Education, Scientific Disciplines; Engineering, Electrical & Electronic",Education & Educational Research; Engineering,RM8DH,WOS:000639887100001,,,,,2022-07-14,0.0014421690222094028,2.470692375004616e-07,0.011423046079741882,0.12164485456650644,0.010616103386607642
