PT,AU,BA,BE,GP,AF,BF,CA,TI,SO,SE,BS,LA,DT,CT,CY,CL,SP,HO,DE,ID,AB,C1,RP,EM,RI,OI,FU,FX,CR,NR,TC,Z9,U1,U2,PU,PI,PA,SN,EI,BN,J9,JI,PD,PY,VL,IS,PN,SU,SI,MA,BP,EP,AR,DI,D2,PG,WC,SC,GA,UT,PM,OA,HC,HP,DA,DC,EC,LC,CC,BC
J,"Wang, L1",,,,"Wang, Lin",,,Global optimization model of regional industrial structure based on conjugate matching cooperative game,INTERNATIONAL JOURNAL OF ELECTRICAL ENGINEERING EDUCATION,,,English,Article; Early Access,,,,,,Conjugate matching cooperative game method; agriculture and animal husbandry; industrial structure; optimization model,,"Whether the regional industrial structure reasonably reflects the level of economic development of a region, and a good industrial structure can promote the development of economic cycle. Agricultural production structure is closely related to water resources and grain yield. Optimizing agricultural industrial structure is related to the national economy and people's livelihood, and has a great impact on the economic development of a region. In this paper, an optimization model based on conjugate cooperative game is established to verify the influence on the development of agricultural industrial structure, and propose solutions. The research has good innovation and guidance. In view of the unreasonable regional industrial structure, starting with the fundamental theoretical research of the regional industrial structure adjustment, a conjugate matching cooperative game method is used to establish a regional industrial structure optimization model. The results suggest that: Wheat planting area is increased by 1.1%, maize planting area is decreased by 40.5%, beans planting area is increased by 16.5%, potato planting area is increased by 18.3%, oil crops planting area is decreased by 5.5%, vegetable planting area is increased by 4.2%, and forage planting area is increased by 5.9%. The proportion of food crops: cash crops: forage is adjusted from 50.0: 11.7: 38.3 to 27.1: 28.7: 44.2, and the structure of agriculture and animal husbandry tends to be rationalized. In this paper, the conjugate matching cooperative game method is used to analyze the model, and the optimization method of regional industrial structure is proposed, which can help agricultural industry to improve production and promote the further optimization of industrial structure.","[Wang, Lin] Haikou Univ Econ, Sch Business Adm, Haikou 571127, Hainan, Peoples R China","Wang, L (corresponding author), Haikou Univ Econ, Sch Business Adm, Haikou 571127, Hainan, Peoples R China.",whu05@qq.com,,,planned project of philosophy and social sciences of Hainan Province: Research on Optimization and Adjustment of Industrial Structure in Hainan Province Constrained by Resources and Environment [HNSK(YB)19-44]; special project of philosophy and social sciences of Hainan Province: The Innovative Research on the Evolution of Island Ecological Civilization and the Division of Green Industry Recycling Type [HNSK(ZX)18-118],"The author(s) disclosed receipt of the following financial support for the research, authorship, and/or publication of this article: This research was awarded the planned project of philosophy and social sciences of Hainan Province: Research on Optimization and Adjustment of Industrial Structure in Hainan Province Constrained by Resources and Environment (Grant NO. HNSK(YB)19-44) and the special project of philosophy and social sciences of Hainan Province: The Innovative Research on the Evolution of Island Ecological Civilization and the Division of Green Industry Recycling Type (Grant NO. HNSK(ZX)18-118).","Boeren F, 2014, MECHATRONICS, V24, P572, DOI 10.1016/j.mechatronics.2014.03.00; Chai TY, 2013, IEEE T IND INFORM, V9, P417, DOI 10.1109/TII.2012.221775; Dou Z, 2014, INT J DISTRIB SENS N, DOI 10.1155/2014/93123; Fernandes MAC, 2017, INT J ELEC ENG EDUC, V54, P223, DOI 10.1177/002072091667583; Mostafa MH, 2020, IEEE ACCESS, V8, P54751, DOI 10.1109/ACCESS.2020.298169; Ng CY, 2011, IEEE T VEH TECHNOL, V60, P729, DOI 10.1109/TVT.2010.209643; Noori M, 2015, ENERGY, V89, P610, DOI 10.1016/j.energy.2015.05.15; Oncel AF., 2016, INT J ENG TECHNOL, V13, P; Rozlan MBM, 2011, INT REV ELECTR ENG-I, V6, P180; Sakib N, 2017, INT J RENEW ENERGY R, V7, P39; Shi GM, 2010, ENERG POLICY, V38, P6172, DOI 10.1016/j.enpol.2010.06.00; Xu F, 2017, J CLEAN PROD, V164, P476, DOI 10.1016/j.jclepro.2017.06.19; Yu SW, 2018, ENERG POLICY, V122, P300, DOI 10.1016/j.enpol.2018.07.03; Zhang XJ, 2013, J HYDROL ENG, V18, P1107, DOI 10.1061/(ASCE)HE.1943-5584.000082; Zhou XY, 2017, J CLEAN PROD, V165, P1462, DOI 10.1016/j.jclepro.2017.07.24",15,1,1,5,15,SAGE PUBLICATIONS LTD,LONDON,"1 OLIVERS YARD, 55 CITY ROAD, LONDON EC1Y 1SP, ENGLAND",0020-7209,2050-4578,,INT J ELEC ENG EDUC,Int. J. Elec. Eng. Educ.,,,,,,,,,,,20720920984670.0,10.1177/0020720920984670,,14,"Education, Scientific Disciplines; Engineering, Electrical & Electronic",Education & Educational Research; Engineering,RG1JZ,WOS:000635292500001,,,,,2022-07-14,0.002163253533314104,0.00022760119827910612,0.028214440404130313,0.13614765364225406,0.028542052475961636
J,"Cheng, L1;  Niu, WC;  Zhao, XG;  Xu, CL;  Hou, ZY",,,,"Cheng, Lin; Niu, Wen-Cheng; Zhao, Xiao-Gang; Xu, Chun-Long; Hou, Zhao-Yang",,,Design and implementation of college physics teaching platform based on virtual experiment scene,INTERNATIONAL JOURNAL OF ELECTRICAL ENGINEERING EDUCATION,,,English,Article; Early Access,,,,,,Virtual technology; virtual laboratory; teaching platform,,"In the study of college physics, experiment is the source of students' discovery and exploration of problems, which plays a crucial role in college physics and is also the focus of physics teaching. This paper mainly studies how to use B/S architecture and MVC design pattern according to the characteristics of college physics teaching, including user management and system function modules. In order to illustrate the role of virtual experiment scene based College Physics Teaching Platform in college physics learning, a virtual physics laboratory teaching platform based on B/S three-tier structure system and MVC mode is constructed by using Java, VRML and flash interactive technology. Based on the advantages of virtual technology, this platform starts with the construction of a teaching platform of virtual experiment scene, analyzes students' mastery of university physics experiments before and after the use of it, and then carries out a systematic survey of students' satisfaction, thus obtaining the influence of this teaching platform on university physics learning of college students. The results show that the platform constructed in this paper can help college students better grasp the operation of physical experiments, so as to better understand the relevant knowledge points in college physics learning, and has a good reference value.","[Cheng, Lin; Zhao, Xiao-Gang; Xu, Chun-Long; Hou, Zhao-Yang] Changan Univ, Coll Sci, Xian 710064, Shaanxi, Peoples R China; [Niu, Wen-Cheng] Xian Qujiang 1 High Sch, Xian, Peoples R China","Cheng, L (corresponding author), Changan Univ, Coll Sci, Xian 710064, Shaanxi, Peoples R China.",Chenglin@chd.edu.cn,,,,,"Barata PNA, 2015, INT J ELEC ENG EDUC, V52, P203, DOI 10.1177/002072091558386; Anony M., 2011, SPRING FRAMEWORK RE; Brett M, 2015, STUD EARLY MEDIEV BR, P; Chai Q., 2009, CHINA ED TECHNIQUE E, P6; Fan XY., 2017, FUJIAN COMPUT, V33, P3; Gao H., 2009, TECHNICAL RES CS B; Jia YC, 2019, INT J ELEC ENG EDUC, DOI 10.1177/002072091986741; Jing W, 2012, RES EXPLOR LAB, V31, P6; Kleinschmidt JH, 2019, INT J ELEC ENG EDUC, DOI 10.1177/002072091986743; Li JW, 2017, ACSR ADV COMPUT, V59, P17; Li XT, 2009, SCI TECHNOL INFORM, P19; Liu Y., 2011, RES VIRTUAL SCENE M; Liu YP., 2011, J MICROCOMPUT, V27, P16; Lv ZH, 2020, NEURAL COMPUT APPL, V32, P9593, DOI 10.1007/s00521-019-04472-; Lv ZH, 2020, IEEE INTERNET THINGS, V7, P4616, DOI 10.1109/JIOT.2019.295458; Lv ZH, 2017, NEUROCOMPUTING, V254, P71, DOI 10.1016/j.neucom.2016.07.07; Ma ZY., 2016, CHEM ENG EQUIP, P30; Oncel AF, 2019, INT J ELEC ENG EDUC, V56, P208, DOI 10.1177/002072091878871; Qi LY, 2017, IEEE J SEL AREA COMM, V35, P2616, DOI 10.1109/JSAC.2017.276045; Qiao YH., 2003, CHINESE J ECOL, V23, P205; Wang F., 2005, J XIAN JIAOTONG U, V40, P138; Wang HX., 2008, DESIGN IMPLEMENTATI; Wang XY, 2017, ACM T INTEL SYST TEC, V9, DOI 10.1145/307885; Xu YJ., 2013, GUANGDONG CHEM IND, V40, P17; Yan JF., 2000, RES WEB DATABASE VI; Zhai B, 2010, CHINA SCI TECHNOL EX, P30; Zhai P., 2015, COMPUT NETW, V41, P4; Zhang YW, 2017, EXAMINATION WEEKLY, P2; Zhu, 2006, COMPUTER TECHNOLOGY, V16, P22",29,1,1,9,15,SAGE PUBLICATIONS LTD,LONDON,"1 OLIVERS YARD, 55 CITY ROAD, LONDON EC1Y 1SP, ENGLAND",0020-7209,2050-4578,,INT J ELEC ENG EDUC,Int. J. Elec. Eng. Educ.,,,,,,,,,,,20720920984688.0,10.1177/0020720920984688,,14,"Education, Scientific Disciplines; Engineering, Electrical & Electronic",Education & Educational Research; Engineering,RG1PR,WOS:000635307400001,,,,,2022-07-14,0.004182290164407268,0.00011852801264139604,0.03322522942423784,0.1407575819089765,0.035257227703103876
J,"Xie, Y1;  Guo, CY;  Xu, SJ;  Luo, G",,,,"Xie, Yi; Guo, Chuanyan; Xu, Shijun; Luo, Ge",,,A comparative analysis of BMI and physical fitness index between Han and minority college students in Guangxi,INTERNATIONAL JOURNAL OF ELECTRICAL ENGINEERING EDUCATION,,,English,Article; Early Access,,,,,,Han college students; minority college students; physical health; BMI,,"To understand the physical condition and change rule of undergraduate students of different nationalities in Guangxi in their four-year life, and to provide basis for Han and minority students to formulate measures to enhance their physical condition and prevent physical decline. By using the methods of literature review and mathematical statistics, the monitoring data of 3314 students of Grade 2015 from Guangxi University of Science and Technology with complete 4-year physical fitness test results were analyzed. 14.45% of the freshmen had normal BMI and the seniors did not meet the standard. 21.03% of the freshmen and seniors did not meet the BMI standard. 10.29% of freshmen whose BMI is not up to standard and seniors are normal; 54.22% of the freshmen and seniors had normal BMI. The differences in height, weight and vital capacity between Han students and minority students are statistically significant. On the whole, the physique of Han students is better than that of minority students. The physical changes of Han students and minority students in 4 years have their own characteristics. It is an effective way to promote the physical health of college students of different nationalities to continuously study and improve the methods and means of physical health monitoring, strengthen the exchange and mutual learning of national cultures, and advocate a healthy campus cultural atmosphere.","[Xie, Yi; Guo, Chuanyan] Guangxi Univ Sci & Technol, Coll Phys Educ, Liuzhou, Peoples R China; [Xie, Yi] Hubei Leisure Sports Dev Res Ctr, Wuhan, Peoples R China; [Xu, Shijun; Luo, Ge] Guangxi Univ Sci & Technol, LuSHan Coll, Liuzhou, Peoples R China","Guo, CY (corresponding author), Guangxi Sci & Technol Normal Univ, Coll Phys Educ, Liuzhou 545004, Peoples R China.",1150125404@qq.com,,,"Hubei leisure sports development research center [2019y008]; 2019 physical education, aesthetic education and labor education special project of LuSHan College of Guangxi University of Science and Technology: Research on the path of College Students' physique monitoring and safety and health education","The author(s) disclosed receipt of the following financial support for the research, authorship, and/or publication of this article: The open fund project of Hubei leisure sports development research center supported Research on Guangxi traditional sports consumption (Grant: 2019y008); 2019 physical education, aesthetic education and labor education special project of LuSHan College of Guangxi University of Science and Technology: Research on the path of College Students' physique monitoring and safety and health education.","BOEVER F, 1948, ARCH INT PHARMACOD T, V77, P; DUNTEMAN GH, 1967, J EXP EDUC, V35, P85, DOI 10.1080/00220973.1967.1101100; Gang L., 2007, J TIANJIN I PHYS ED, P14; Guo W., 2017, J HOTAN NORMAL COLL, V36, P5; Jianjun Y., 2014, SCH HLTH CHINA, V35, P140; Keli F., 2004, DEP HIGHER ED MINIST, P36; LeBoeuf RL, 2018, INT J ELEC ENG EDUC, V55, P155, DOI 10.1177/002072091875625; Luo C., 2018, GUANGXI ETHNIC STUD, P1; Na Z., 2013, INVESTIGATION ANAL ; Ospina Juan, 2019, IEEE Power and Energy Technology Systems Journal, V6, P195, DOI 10.1109/JPETS.2019.293570; Quansheng S., 2012, SPORTS PHYSL, P45; Sakib N, 2017, INT J RENEW ENERGY R, V7, P39; Tan X., 2008, LEISURE ED ETHNIC C; Yadav D, 2018, INT J ELEC ENG EDUC, V55, P44, DOI 10.1177/002072091775095",14,0,0,45,52,SAGE PUBLICATIONS LTD,LONDON,"1 OLIVERS YARD, 55 CITY ROAD, LONDON EC1Y 1SP, ENGLAND",0020-7209,2050-4578,,INT J ELEC ENG EDUC,Int. J. Elec. Eng. Educ.,,,,,,,,,,,20720920984680.0,10.1177/0020720920984680,,15,"Education, Scientific Disciplines; Engineering, Electrical & Electronic",Education & Educational Research; Engineering,RG1RP,WOS:000635312400001,,,,,2022-07-14,0.002019036631093164,1.1245119330879369e-05,0.0203435720302072,0.13899691296155234,0.020442903723672683
J,"Zhao, R1;  Shi, WB",,,,"Zhao, Rui; Shi, Wan-Bing",,,Study of graduate attributes of the university of Sydney and implications for building Chinese world-class universities,INTERNATIONAL JOURNAL OF ELECTRICAL ENGINEERING EDUCATION,,,English,Article; Early Access,,,,,,University of Sydney; graduate attributes; enabling conceptions; translation conceptions; Chinese top-level universities,,"The graduate attributes of the University of Sydney innovatively include the enabling conceptions and the translation conceptions of attributes and ensure that they are specifically oriented, reasonably structured and comprehensively designed. These scientifically constructed graduate attributes of the University of Sydney prove strong efficiency by the university taking up a high position in QS Graduate Employability Rankings in recent years. Chinese top-level universities, in the process of building world-class universities, also face the task of revising the graduate attributes and substantially enhancing the quality of talents cultivation, and can, therefore, learn the successful experience to revise their own graduate attributes on the basis of universities' history, vision and specialty, on the premise of a sound cognition of the connotation, levels, and relationship of graduate attributes, and by means of System Theory, Phenomenography and comparative study.","[Zhao, Rui] Northeastern Univ, Sch Humanities & Law, Shenyang, Peoples R China; [Zhao, Rui] Northeastern Univ, Foreign Studies Coll, Shenyang, Peoples R China; [Shi, Wan-Bing] Nanjing Normal Univ Special Educ, Special Educ Res Ctr, Nanjing, Peoples R China","Zhao, R (corresponding author), Northeastern Univ, Shenyang 110819, Peoples R China.",ginazhaorui@163.com,,,"National Social Science Foundation Education Project, Research on the Evaluation System of Scientific Research Performance of College Humanities and Social Sciences Teachers [BFA150043]; Northeastern University Graduate Education Research Project 2020, Research on the Quality Evaluation Index System of Northeast University Graduate International Talents","The author(s) disclosed receipt of the following financial support for the research, authorship, and/or publication of this article: This paper was supported by (1) National Social Science Foundation Education Project, Research on the Evaluation System of Scientific Research Performance of College Humanities and Social Sciences Teachers, No. BFA150043; (2) Northeastern University Graduate Education Research Project 2020, Research on the Quality Evaluation Index System of Northeast University Graduate International Talents.","Barrie S, 2006, HIGH EDUC, V51, P215, DOI 10.1007/s10734-004-6384-; Barrie S., 2004, HIGH EDUC RES DEV, V23, P26; Barrie S, 2006, LIFELONG LEARN BOOK, V6, P14; Barrie SC, 2007, STUD HIGH EDUC, V32, P439, DOI 10.1080/0307507070147610; Cope C., 2004, QUAL RES J, V4, P; DGES_Higher_Education_General_Office, 2020, SKILLS POSTCOVID SK; Gao Y, 2018, HIGH EDUC, V76, P317, DOI 10.1007/s10734-017-0210-; Hill J, 2016, J GEOGR HIGHER EDUC, V40, P222, DOI 10.1080/03098265.2016.114012; Klionsky Daniel J., 2016, Autophagy, V12, P1, DOI 10.1080/15548627.2015.110035; Li YB, 2017, ORIENTATION TALENT C, P; Ma WH, 2015, HIGH EDUC, V70, P217, DOI 10.1007/s10734-015-9899-; Mohamed KG, 2014, HUM RESOUR HEALTH, V12, DOI 10.1186/1478-4491-12-; Tight M, 2016, INT J SOC RES METHOD, V19, P319, DOI 10.1080/13645579.2015.101028; UNESCO, 2014, GEOCODI; Wang YS., 2016, CHINA HIGH ED RES, V8, P1",15,0,0,4,8,SAGE PUBLICATIONS LTD,LONDON,"1 OLIVERS YARD, 55 CITY ROAD, LONDON EC1Y 1SP, ENGLAND",0020-7209,2050-4578,,INT J ELEC ENG EDUC,Int. J. Elec. Eng. Educ.,,,,,,,,,,,20720920984311.0,10.1177/0020720920984311,,12,"Education, Scientific Disciplines; Engineering, Electrical & Electronic",Education & Educational Research; Engineering,RE2TC,WOS:000634012300001,,,,,2022-07-14,0.002163253533314104,3.730193495519713e-10,0.0040342873864897735,0.0749265214384509,0.0040342873864897735
J,"Hu, L1;  Yao, W",,,,"Hu, Lin; Yao, Wei",,,Design and implementation of college English multimedia aided teaching resources,INTERNATIONAL JOURNAL OF ELECTRICAL ENGINEERING EDUCATION,,,English,Article; Early Access,,,,,,College English; multimedia aid; knowledge classification; instructional design,,"With the advancement of multimedia technology, a series of problems have emerged in the reform of college English teaching. How to use multimedia to assist college students in English learning has become a meaningful study. Multimedia-assisted instruction is a common method of teaching English. The design of multimedia-assisted English teaching resource software determines its development, management, evaluation and other aspects, so the design of multimedia platform plays a vital role in the effect of multimedia teaching. This paper will discuss the design and implementation of multimedia-assisted college English independent education resources from the perspective of knowledge classification. Through the content analysis, some problems exist in the design process of some college English multimedia teaching, and the status quo is analyzed. It also studies the difficulties of college students in the process of multimedia assisted learning, and how college students hope to design multimedia independent learning multimedia platform. Finally, the five knowledge classification learning theories of listening, speaking, reading, writing and translating can change the status quo, meet the needs of college students, and develop the knowledge of vocabulary, grammar and listening in college English. The design strategy of self-learning multimedia-assisted instruction and the design of college English self-learning multimedia teaching is briefly written.","[Hu, Lin] Jilin Univ Finance & Econ, Foreign Language Teaching & Res Inst, Jilin, Jilin, Peoples R China; [Yao, Wei] Wuhan Univ Technol, Foreign Language Sch, Wuhan 430070, Hubei, Peoples R China","Yao, W (corresponding author), Wuhan Univ Technol, Foreign Language Sch, Wuhan 430070, Hubei, Peoples R China.",yaoweivivian@126.com,,,,,"Chang Y, 2015, MULTIMED TOOLS APPL, V74, P2219, DOI 10.1007/s11042-014-1886-; Cheng YM, 2015, ASIA PAC MANAG REV, V20, P109, DOI 10.1016/j.apmrv.2014.12.01; Daniel LM., 2015, INFORM SECURITY, P49; Gao Y., 2016, INT C INT TRANS; Huang YT., 2016, IEEE INT C ADV LEAR; Imran AS, 2014, LECT NOTES COMPUT SC, V8523, P151, DOI 10.1007/978-3-319-07482-5_1; Jackson W, 2014, BEGINNING JAVA 8 GAM, P10; Jiefeng W., 2016, 6 INT C INT SYST DE; Jin YJ, 2014, PROCEEDINGS OF 2014 IEEE WORKSHOP ON ADVANCED RESEARCH AND TECHNOLOGY IN INDUSTRY APPLICATIONS (WARTIA), P764, DOI 10.1109/WARTIA.2014.697638; Jinping L., 2016, 8 INT C MEAS TECHN ; Juan Z., 2017, INT C INT TRANS; Lee WH., 2015, IMPLICIT AUTHENTICA; Liu M., 2014, IEEE WORKSH ADV RE; Liu M., 2017, ADV RES TECHNOLOGY ; Lou MS, 2017, INT J EMERG TECHNOL, V12, P119, DOI 10.3991/ijet.v12i01.648; Muslem A, 2017, INT J INSTR, V10, P203, DOI 10.12973/iji.2017.10113; Oh S, 2015, MULTIMED TOOLS APPL, V74, P6413, DOI 10.1007/s11042-014-2093-; Robert L., 2014, TESTBEDS RES INFRAST, P22; Ryu D, 2014, I SYMP CONSUM ELECT; Stojakovic B., 2017, POLYTECHNIC DESIGN, V5, P29; Sun D., 2014, ADV RES TECHNOLOGY ; Taveira-Gomes T, 2016, J MED INTERNET RES, V18, DOI 10.2196/jmir.546; Xue G., 2018, AD VANCES LANGUAGE L, V; Yang HC, 2017, MULTIMED TOOLS APPL, V76, P11651, DOI 10.1007/s11042-016-3325-; Yi N., 2014, 6 INT C MEAS TECHN ; Yost KJ, 2009, PATIENT EDUC COUNS, V75, P295, DOI 10.1016/j.pec.2009.02.02",26,0,0,3,17,SAGE PUBLICATIONS LTD,LONDON,"1 OLIVERS YARD, 55 CITY ROAD, LONDON EC1Y 1SP, ENGLAND",0020-7209,2050-4578,,INT J ELEC ENG EDUC,Int. J. Elec. Eng. Educ.,,,,,,,,,,,20720920983517.0,10.1177/0020720920983517,,16,"Education, Scientific Disciplines; Engineering, Electrical & Electronic",Education & Educational Research; Engineering,RG2AZ,WOS:000635337200001,,,,,2022-07-14,0.0037496394577444473,4.270722397138949e-06,0.006924568059198143,0.11208819630791116,0.006916643180742055
J,"Zhang, L1;  Tian, D",,,,"Zhang, Lei; Tian, Dan",,,The application value of midwifery leading companion doula in puerpera birth nursing,INTERNATIONAL JOURNAL OF ELECTRICAL ENGINEERING EDUCATION,,,English,Article; Early Access,,,,,,The midwife; companion doula; primipara; birth nursing; time of labor; the nursing value,,"Purpose To evaluate the effect of midwifery-led doula companion care in puerpera delivery nursing. Methods 126 primiparas were admitted to our hospital from June 2018 to November 2019 by random sampling method. According to the order of admission of primiparas, they were divided into conventional group (63 cases) and study group (63 cases). The routine group of primiparas were given routine delivery care, while the research group of primiparas were given doula accompanied care by midwives. The time of labor, pregnancy outcome, delivery pain score, delivery control and anxiety score of the two groups were compared and analyzed. Results Compared with the conventional group, the time of the first, second and total labor was significantly shorter in the study group (P < 0.05). The amount of postpartum hemorrhage in the study group was significantly less than that in the conventional group (P < 0.05). The rate of perineal incision and perineal laceration in the study group was significantly lower than that in the conventional group (P < 0.05). There was no significant difference in Apgar score <8 points compared with the control group (P > 0.05). The scores of pain and anxiety in the second stage of labor were significantly lower in the study group than in the conventional group (P < 0.05). The control score of the puerpera in the study group was significantly higher than that in the conventional group (P < 0.05). Conclusion The intervention measures of companion doula led by midwives can effectively shorten the time of labor, reduce the anxiety and pain score and improve the sense of control during labor of primiparas. This nursing method has clinical promotion and application value.","[Zhang, Lei; Tian, Dan] Capital Med Univ, Beijing Luhe Hosp, Tongshige St, Beijing 101149, Tongzhou Distri, Peoples R China","Tian, D (corresponding author), Capital Med Univ, Beijing Luhe Hosp, Tongshige St, Beijing 101149, Tongzhou Distri, Peoples R China.",z15910774655@163.com,,,,,"Celik E, 2018, ENG SCI TECHNOL, V21, P1104, DOI 10.1016/j.jestch.2018.08.00; Chunlei X, 2012, QILU NURS J, V18, P5; Gailing L, 2020, CAPITAL FOOD MED, V27, P18; Lio-Xiang W, 2019, HEILONGJIANG MED SCI, V42, P16; Mi L, 2020, CONT NURSES, V27, P8; Mosaad AM, 2019, AIN SHAMS ENG J, V10, P755, DOI 10.1016/j.asej.2019.07.00; Qing-Qing X, 2019, CONT MED, V25, P3; Ruixia A, 2018, MOD MED IMAGING, V27, P294; Shumin Y, 2020, CAPITAL FOOD MED, V27, P17; Sun Y, 2020, HENAN MED RES, V29, P56; Wenmin X, 2020, CHIN FOREIGN MED RES, V18, P7; Xiangyue L., 2020, MOD MED HLTH, V36, P43; Xiexiu Y, 2013, CHIN MED INNOVATION, V10, P12; Xinmei Z, 2019, NURS PRACT RES, V16, P9; Yanmei L., 2019, CHIN FOREIGN MED RES, V17, P17; Yuan Y, 2019, PROG MOD BIOMED, V19, P93; Yue R, 2020, MED EQUIP, V33, P18; Zhang YS, 2020, IEEE T MULTIMEDIA, V22, P2844, DOI 10.1109/TMM.2020.296688; Zhen-Ye M, 2019, J PRACT CLIN MED, V23, P11",19,0,0,4,10,SAGE PUBLICATIONS LTD,LONDON,"1 OLIVERS YARD, 55 CITY ROAD, LONDON EC1Y 1SP, ENGLAND",0020-7209,2050-4578,,INT J ELEC ENG EDUC,Int. J. Elec. Eng. Educ.,,,,,,,,,,,20720920984006.0,10.1177/0020720920984006,,8,"Education, Scientific Disciplines; Engineering, Electrical & Electronic",Education & Educational Research; Engineering,RC1TL,WOS:000632584300001,,,,,2022-07-14,0.0027401211421978653,7.481566883629158e-08,0.014565853160012009,0.11249553846653039,0.0139613485015057
