PT,AU,BA,BE,GP,AF,BF,CA,TI,SO,SE,BS,LA,DT,CT,CY,CL,SP,HO,DE,ID,AB,C1,RP,EM,RI,OI,FU,FX,CR,NR,TC,Z9,U1,U2,PU,PI,PA,SN,EI,BN,J9,JI,PD,PY,VL,IS,PN,SU,SI,MA,BP,EP,AR,DI,D2,PG,WC,SC,GA,UT,PM,OA,HC,HP,DA,DC,EC,LC,CC,BC
J,"Khubalkar, S1;  Junghare, A;  Aware, M;  Das, S",,,,"Khubalkar, Swapnil; Junghare, Anjali; Aware, Mohan; Das, Shantanu",,,Unique fractional calculus engineering laboratory for learning and research,INTERNATIONAL JOURNAL OF ELECTRICAL ENGINEERING EDUCATION,,,English,Article,,,,,,Controller; electrical engineering; field-programmable gate array; fractional calculus; laboratory; simulation,IMPLEMENTATION; REALIZATION; DIFFERENTIATOR; CONTROLLER; SYSTEMS; DESIGN,"In this paper, a novel prototype laboratory is presented for engineering education, in which experiments are based on the fractional calculus. The prototypes of analog and digital fractional-order proportional-integral-derivative (PID) controllers are built in the laboratory. These fractional-order PID controllers are applied to linear and nonlinear plants to demonstrate the effectiveness of fractional-order calculus in real time. These experiments are designed, developed, and implemented on the analog and digital platforms. These controllers are integrated to control the DC motor, brushless DC motor, and magnetic levitation modules through hardware-in-loop as well as stand-alone systems. The analog type of fractional-order PID implementation is carried out by using passive components (i.e. resistances and capacitances) with an operational amplifier. However, real-time digital implementation is carried out using field-programmable gate array and digital signal processor. This paper describes how the experiments on fractional calculus can be tailored for graduate, undergraduate students' education and extended for research in this emerging area.","[Khubalkar, Swapnil; Junghare, Anjali; Aware, Mohan] VNIT, Nagpur, Maharashtra, India; [Das, Shantanu] Bhabha Atom Res Ctr, Mumbai, Maharashtra, India","Khubalkar, S (corresponding author), VNIT, Elect Engn Dept, Nagpur, Maharashtra, India.",swapnilkhubalkar@students.vnit.ac.in,"Aware, Mohan/AAK-8513-2020; Khubalkar, Swapnil W/D-9302-2019; Khubalkar, Swapnil/I-7365-2015","Khubalkar, Swapnil W/0000-0002-7845-3355; Khubalkar, Swapnil/0000-0002-7845-3355",Board of Research in Nuclear Sciences [2012/36/69],"The author(s) disclosed receipt of the following financial support for the research, authorship, and/or publication of this article: This research was supported by Board of Research in Nuclear Sciences, project sanction no. 2012/36/69.","Adhikary A., 2017, INA LETT, V2, P41, DOI [10.1007/s41403-017-0020-1, DOI 10.1007/S41403-017-0020-1; Adhikary A, 2016, IEEE T CIRCUITS-I, V63, P1142, DOI 10.1109/TCSI.2016.256826; Alsaedi A, 2015, ADV MECH ENG, V7, DOI 10.1177/168781401561812; Anand S, 2012, IEEE T EDUC, V55, P573, DOI 10.1109/TE.2012.220068; [Anonymous], FUNCTIONAL FRACTIONAL CALCULUS, SECOND EDITIO; Aware MV, 2017, ANALOG INTEGR CIRC S, V91, P131, DOI 10.1007/s10470-016-0920-; Biswas K, 2006, IEEE T CIRCUITS-II, V53, P802, DOI 10.1109/TCSII.2006.87910; Calderon AJ, 2006, SIGNAL PROCESS, V86, P2803, DOI 10.1016/j.sigpro.2006.02.02; Chen X, 2017, IEEE T POWER ELECTR, V32, P7034, DOI 10.1109/TPEL.2016.262878; Chopade AS, 2018, IEEE-CAA J AUTOMATIC, V5, P977, DOI 10.1109/JAS.2016.751018; Chopade AS, 2016, 2016 IEEE FIRST INTERNATIONAL CONFERENCE ON CONTROL, MEASUREMENT AND INSTRUMENTATION (CMI), P331, DOI 10.1109/CMI.2016.741376; Debnath L., 2003, INT J MATH MATH SCI, V54, P3413, DOI [10.1155/S0161171203301486, DOI 10.1155/S0161171203301486; Dhabale AS, 2015, ASIAN J CONTROL, V17, P2143, DOI 10.1002/asjc.114; Dimeas I, 2017, AEU-INT J ELECTRON C, V78, P192, DOI 10.1016/j.aeue.2017.03.01; Dwivedi P, 2017, J FRANKLIN I, V354, P7732, DOI 10.1016/j.jfranklin.2017.09.01; Elwakil AS, 2010, IEEE CIRC SYST MAG, V10, P40, DOI 10.1109/MCAS.2010.93863; Estakhrouiyeh MR, 2017, T I MEAS CONTROL, V40, P177; Freeborn TJ, 2015, MATER RENEW SUSTAIN, V4, DOI 10.1007/s40243-015-0052-; Jiang CX, 2007, ADVANCES IN FRACTIONAL CALCULUS, P333, DOI 10.1007/978-1-4020-6042-7_2; Johansson H, 2013, IEEE J EM SEL TOP C, V3, P404, DOI 10.1109/JETCAS.2013.227385; Khanra M, 2013, J FRANKLIN I, V350, P1753, DOI 10.1016/j.jfranklin.2013.05.00; Khubalkar SW, 2016, 2016 IEEE FIRST INTERNATIONAL CONFERENCE ON CONTROL, MEASUREMENT AND INSTRUMENTATION (CMI), P326, DOI 10.1109/CMI.2016.741376; Khubalkar S, 2017, TURK J ELECTR ENG CO, V25, P4223, DOI 10.3906/elk-1612-27; Khubalkar S, 2016, CIRC SYST SIGNAL PR, V35, P2189, DOI 10.1007/s00034-016-0262-; Khubalkar SW, 2018, ISA T, V82, P79, DOI 10.1016/j.isatra.2017.08.01; Krishna BT, 2011, SIGNAL PROCESS, V91, P386, DOI 10.1016/j.sigpro.2010.06.02; Muresan CI, 2013, MECHATRONICS, V23, P798, DOI 10.1016/j.mechatronics.2013.04.00; Naumovic MB, 2014, ELECTR ENG, V96, P267, DOI 10.1007/s00202-013-0292-; Ogata K., 1995, DISCRETE TIME CONTR; Oustaloup A, 2000, IEEE T CIRCUITS-I, V47, P25, DOI 10.1109/81.81738; Podlubny I, 1999, IEEE T AUTOMAT CONTR, V44, P208, DOI 10.1109/9.73914; Rapaic MR, 2011, ELECTR ENG, V93, P91, DOI 10.1007/s00202-011-0195-; Swain SK, 2017, AEU-INT J ELECTRON C, V78, P141, DOI 10.1016/j.aeue.2017.05.02; Tenreiro Machado J. A., 2001, FRACT CALC APPL ANAL, V4, P4; Verma R, 2017, ARAB J SCI ENG, V42, P3409, DOI 10.1007/s13369-017-2500-",35,8,8,0,20,SAGE PUBLICATIONS LTD,LONDON,"1 OLIVERS YARD, 55 CITY ROAD, LONDON EC1Y 1SP, ENGLAND",0020-7209,2050-4578,,INT J ELEC ENG EDUC,Int. J. Elec. Eng. Educ.,JAN,2020.0,57.0,1.0,,,,,3.0,23.0,,10.1177/0020720918799509,,21,"Education, Scientific Disciplines; Engineering, Electrical & Electronic",Education & Educational Research; Engineering,JT5LH,WOS:000501030700001,,,,,2022-07-14,0.00504759157773291,5.0048414795656436e-11,0.009783410051400127,0.0772366779540189,0.009783410051400127
J,"Sim, S1;  Choi, H",,,,"Sim, Sungho; Choi, Hanyong",,,A study on the service discovery support method in the IoT environments,INTERNATIONAL JOURNAL OF ELECTRICAL ENGINEERING EDUCATION,,,English,Article,,,,,,Internet of Things environment; services discovery; scalable information; web; web service,INTERNET; THINGS,"The fourth Industrial Revolution is rapidly growing due to the development of ICT and the need for organic linkage in the industry. The Internet of Things (IoT), in which objects and objects from active relationships such as sensing, networking and mutual cooperation without human intervention is the core technology of the fourth Industrial Revolution, which can be linked to various industrial fields. As the IoT environment spreads, IoT devices are continuously increasing in various industries. IoT devices connected to the Internet are as different as each application environment. Many information is derived from the interaction between an IoT device and a device or between a human and an IoT device, as well as devices that provide simple data such as sensing. This paper proposes a support method to enable extended service search when users search for services using information generated in IoT environment. The existing service discovery method focuses on the method by which the user selects the service based on the simple service information disclosed by the service provider. In order to solve the problem of existing service discovery method, this study proposed a support method that enables users to search service discovery flexibly even when using existing methods in service discovery in IoT environment. The proposed method provides a user-centered service search environment construction through a search method using user IoT information which was not considered in the existing service search. This makes up for the problem of service availability and provider-oriented service discovery through the establishment of a user service discovery environment.","[Sim, Sungho] Semyung Univ, Sch Informat & Commun Sci, Jecheon, South Korea; [Choi, Hanyong] Shinhan Univ, Div IT Convergence Engn, Dongducheon, South Korea","Choi, H (corresponding author), Shinhan Univ, Div IT Convergence Engn, Dongducheon, South Korea.",hychoi@shinhan.ac.kr,,,,,"Atzori L, 2010, COMPUT NETW, V54, P2787, DOI 10.1016/j.comnet.2010.05.01; Bormann C, 2010, IETF J, V; Gubbi J, 2013, FUTURE GENER COMP SY, V29, P1645, DOI 10.1016/j.future.2013.01.01; Hai ZG, 2004, J SYST SOFTWARE, V70, P107, DOI [10.1016/S0164-1212(03)00003-7, 10.1016/S0164-1212(02)00003-7; Harshavardhanan P., 2012, COMP COMM INF ICCCI, P; Hyung-Jun Yim, 2014, Journal of KIISE: Computing Practices and Letters, V20, P4; Lee STM, 2016, FRONT MICROBIOL, V7, DOI 10.3389/fmicb.2016.0037; 김미정, 2017, [Korean Computers and Accounting Review, 전산회계연구], V15, P; Object Management Group, 2006, DAT DISTR SERV REA; Platzer C, 2005, Third European Conference on Web Services, Proceedings, P6; Sajjanhar A, 2004, AS PAC WEB C HANGZH, P65; Schmidt E., 2013, NEW DIGITAL AGE, P31; Youngsang K, 2017, KOREA I INFORM TECHN, V15, P; Zanella A, 2014, IEEE INTERNET THINGS, V1, P22, DOI 10.1109/JIOT.2014.230632",14,7,7,1,7,SAGE PUBLICATIONS LTD,LONDON,"1 OLIVERS YARD, 55 CITY ROAD, LONDON EC1Y 1SP, ENGLAND",0020-7209,2050-4578,,INT J ELEC ENG EDUC,Int. J. Elec. Eng. Educ.,JAN,2020.0,57.0,1.0,,,,,85.0,96.0,,10.1177/0020720918813824,,12,"Education, Scientific Disciplines; Engineering, Electrical & Electronic",Education & Educational Research; Engineering,JT5LH,WOS:000501030700007,,Bronze,,,2022-07-14,0.002019036631093164,2.6136947840275106e-06,0.0037463944214331155,0.08384522370012092,0.0037463944214331155
J,"Kolimas, L1;  Lapczynski, S;  Szulborski, M",,,,"Kolimas, Lukasz; Lapczynski, Sebastian; Szulborski, Michal",,,Tulip contacts: Experimental studies of electrical contacts in dynamic layout with the use of FEM software,INTERNATIONAL JOURNAL OF ELECTRICAL ENGINEERING EDUCATION,,,English,Article; Early Access,,,,,,Experimental studies; tulip contact; FEM; electrical engineering; methodology,EDUCATION; INTERACTIVITY; EXPERIENCE,"A proper and successful methodology of electrical contact design is achieved by combining the theoretical and practical studies. This paper presents an instructional approach involving FEM simulations in order to aid in the practical operations on electrical contacts in MV and HV electrical apparatuses effectively. Prior to the completed engineering and scientific work in the field of the electrical apparatuses, constructing the FEM-based model is an effective way to achieve and understand the pros and cons of the experimental solutions. This design method is widely used by the industrial companies and can be implemented as an educational method giving young engineers a new edge. The desired effect of the proposed course was to develop student understanding of electrical contacts engineering by combining the theoretical (simulations) and the practical approach. Ordered creativity was successfully put into practice by checking the parameters derived from the simulations on the real scale layout, which affected and enhanced student confidence in the field and in engineering skills. This instructional approach consisted of two sections (The Theoretical and the Practical) and is essential for understanding and further exploiting the acquired knowledge and certain other measures in engineering work. Moreover, it renders a complete engineering experience employing consequences and their impact on experimental electrical contact research based on multitasking and diversity. The statistical analysis proved that the proposed method had a significant impact and yielded improved results. Moreover, a major improvement in student learning and satisfaction after participating in the proposed course was noted.","[Kolimas, Lukasz; Lapczynski, Sebastian; Szulborski, Michal] Warsaw Univ Technol, Inst Elect Power Engn, Ul Koszykowa 75, PL-00662 Warsaw, Poland","Szulborski, M (corresponding author), Warsaw Univ Technol, Inst Elect Power Engn, Ul Koszykowa 75, PL-00662 Warsaw, Poland.",mm.szulborski@gmail.com,"Szulborski, Michał/AHC-9746-2022",,,,"Abdulwahed M, 2014, COMPUT APPL ENG EDUC, V22, P110, DOI 10.1002/cae.2053; Bird J., 2003, ELECT CIRCUIT THEOR; Braunovic M, 2010, ELECTR CONTACT, P28; Braunovic M, 2006, SERIES ELECT COMPUTE, P67; Cabecinhas D, 2016, IEEE T CONTR SYST T, V24, P400, DOI 10.1109/TCST.2015.245444; Chou YC., 2019, INT J ELEC ENG EDUC, V2019, P1, DOI [10.1177/0020720919834669, DOI 10.1177/0020720919834669; Feisel LD, 2005, J ENG EDUC, V94, P121, DOI 10.1002/j.2168-9830.2005.tb00833.; Glennie J., 2012, UNESCO COMMONWEALTH, P1; Guzman JL, 2013, COMPUT APPL ENG EDUC, V21, P360, DOI 10.1002/cae.2048; Guzman JL, 2016, IEEE CONTR SYST MAG, V36, P63, DOI 10.1109/MCS.2015.249509; Ionescu CM, 2013, IEEE T EDUC, V56, P436, DOI 10.1109/TE.2013.224951; Jong BS, 2013, IEEE T EDUC, V56, P292, DOI 10.1109/TE.2012.221737; Kuffel E., 2000, HIGH VOLTAGE ENG FU; Li H., 2015, ASSESS EVAL HIGH EDU, V41, P24; Lundquist C, 2013, IEEE T EDUC, V56, P261, DOI 10.1109/TE.2012.221187; Margaryan A., 2008, WORK BASED LEARNIN; Merrill M. D., 2009, INSTRUCTIONAL DESIGN, V3, P; Merrill M. David, 2013, 1 PRINCIPLES INSTRU; Merrill MD, 2002, ETR&D-EDUC TECH RES, V50, P43, DOI 10.1007/BF0250502; Nunez Jose Luis Martin, 2014, 2014 IEEE Frontiers in Education Conference (FIE). Proceedings, P1, DOI 10.1109/FIE.2014.704450; Oakes WC, 2015, PROC FRONT EDUC CONF, P; Ozerdem OC, 2016, INT J ELEC ENG EDUC, V53, P331, DOI 10.1177/002072091663032; Regalado A., 2012, MIT TECHNOL REV, V116, P6; Ros S, 2014, IEEE T EDUC, V57, P248, DOI 10.1109/TE.2014.233121; Schopt T., 2014, P INT IEEE HOLM C E; Slade G. P., 2017, ELECT CONTACTS PRIN; Slade PG, 2013, ELECTR CONTAC; Tovar E, 2014, IEEE T EDUC, V57, P213, DOI 10.1109/TE.2014.235925; Zhang Zhi, 2011, Proceedings of the 2011 International Symposium on Information Technology in Medicine and Education (ITME 2011), P124, DOI 10.1109/ITiME.2011.613079",29,3,3,2,10,SAGE PUBLICATIONS LTD,LONDON,"1 OLIVERS YARD, 55 CITY ROAD, LONDON EC1Y 1SP, ENGLAND",0020-7209,2050-4578,,INT J ELEC ENG EDUC,Int. J. Elec. Eng. Educ.,,,,,,,,,,,20720919891069.0,10.1177/0020720919891069,,20,"Education, Scientific Disciplines; Engineering, Electrical & Electronic",Education & Educational Research; Engineering,KC1YV,WOS:000506982800001,,,,,2022-07-14,0.004182290164407268,0.0005701782172593734,0.03383909125770589,0.12829336885731202,0.03177651578118555
J,"Liu, J21;   Liang, CY;   Chen, R;   Mei, GX;   Wu, YD",,,,"Liu, Jian; Liang, Chuanyang; Chen, Rui; Mei, Guoxiong; Wu, Yuedong",,,Mechanism analysis on ground settlement induced by vacuum removal,INTERNATIONAL JOURNAL OF ELECTRICAL ENGINEERING EDUCATION,,,English,Article; Early Access,,,,,,Soft clayey soil; vacuum preloading; deformation; vacuum removal,STIFFNESS; SOILS; FIELD,"Due to the settlement hazards induced by the soft clayey soils, vacuum preloading has been widely used all over the world. Many studies focus on the process of vacuum application but the process of vacuum removal is generally ignored. Different from observations on surcharge preloading, ground settlement rather than heave occurred during vacuum removal. In this study, a stress-controlled triaxial test was carried out to simulate both processes of vacuum application and removal applied on a clayey soil and hence the mechanism of ground settlement induced by vacuum removal is discussed. Compressive axial strain was observed during the decrease of isotropic stress that simulated vacuum removal. To better understand the observed deformation characteristics of the clayey soils during vacuum removal, in this study, a simple anisotropic elastic model was used. The happening of ground settlement of the clayey soil during vacuum removal is mainly because that the Young's modulus in the vertical direction is higher than that in the horizontal direction. Lateral extension is dominant for the ground deformation during vacuum removal.","[Liu, Jian; Liang, Chuanyang; Wu, Yuedong] Hohai Univ, Geotech Res Inst, Key Lab Minist Educ Geomech & Embankment Engn, Nanjing, Peoples R China; [Chen, Rui] Harbin Inst Technol, Shenzhen Sch, Shenzhen Key Lab Urban & Civil Engn Disaster Prev, Shenzhen, Peoples R China; [Mei, Guoxiong] Guangxi Univ, Coll Civil Engn & Architecture, Key Lab Disaster Prevent & Struct Safety, Minist Educ, Nanning, Peoples R China","Chen, R (corresponding author), Harbin Inst Technol, Shenzhen Sch, Shenzhen Key Lab Urban & Civil Engn Disaster Prev, Shenzhen, Peoples R China.",chenrui1005@hotmail.com,,,"National Natural Science Foundation of China [51608152, 51322807]; Fundamental Research Funds for the Central Universities [2019B73814]; Natural Science Foundation of Guangdong Province China [2016A030310368]; National Key Research and Development Program of China [2017YFC0404803]; Postgraduate Research & Practice Innovation Program of Jiangsu Province [SJKY19_0449]","The author(s) disclosed receipt of the following financial support for the research, authorship, and/or publication of this article: The authors thank for the support from the National Natural Science Foundation of China (Grant Nos 51608152 and No. 51322807), the Fundamental Research Funds for the Central Universities (No. 2018b00714 and 2015B25914), the Natural Science Foundation of Guangdong Province China (No. 2016A030310368), National Key Research and Development Program of China (No. 2017YFC0404803), Postgraduate Research & Practice Innovation Program of Jiangsu Province (No. SJKY19_0449) and the Fundamental Research Funds for the Central Universities (No. 2019B73814).","[Anonymous], 2007, STANDARD TEST METHO; ASTM, 2017, D431817 ASTM IN; ASTM D2487-11, 2011, D248711 ASTM IN; ATKINSON JH, 1990, GEOTECHNIQUE, V40, P531, DOI 10.1680/geot.1990.40.4.53; Bergado DT, 2002, CAN GEOTECH J, V39, P304, DOI 10.1139/T01-10; Chai JC, 2005, J GEOTECH GEOENVIRON, V131, P1552, DOI 10.1061/(ASCE)1090-0241(2005)131:12(1552; Chakrabarty J., 2006, THEORY PLASTICIT; Chen R, 2019, EUR J SOIL SCI, V70, P493, DOI 10.1111/ejss.1276; Chen R, 2019, J HYDROL, V568, P260, DOI 10.1016/j.jhydrol.2018.10.05; Chu J, 2012, INT J GEOMECH, V5, P15; Holtz RD., 1975, J TRANSPORT RES BOAR, V548, P2; Indraratna B, 2004, CAN GEOTECH J, V41, P1098, DOI [10.1139/t04-054, 10.1139/T04-054; Kianfar K, 2015, CAN GEOTECH J, V52, P2156, DOI 10.1139/cgj-2014-051; Lings ML, 2000, GEOTECHNIQUE, V50, P109, DOI 10.1680/geot.2000.50.2.10; Muir WD., 2004, GEOTECHNICAL MODELL; Noble CA., 2011, CAN GEOTECH J, V3, P3; Noorzad R, 2014, ARAB J GEOSCI, V7, P623, DOI 10.1007/s12517-012-0771-; Pennington DS, 1997, GEOTECHNIQUE, V47, P391, DOI 10.1680/geot.1997.47.3.39; Robinson RG, 2012, CAN GEOTECH J, V49, P729, DOI [10.1139/t2012-024, 10.1139/T2012-024; Samson L, 2011, CAN GEOTECH J, V9, P44; Scher AD, 2018, INT J ELEC ENG EDUC, V55, P367, DOI 10.1177/002072091877504; Schofield AN., 1968, CRITICAL STATE SOI; Shi JW, 2019, COMPUT GEOTECH, V116, DOI 10.1016/j.compgeo.2019.10321; Shi JW, 2019, COMPUT GEOTECH, V106, P108, DOI 10.1016/j.compgeo.2018.10.01; Wang J, 2016, J GEOTECH GEOENVIRON, V142, DOI 10.1061/(ASCE)GT.1943-5606.000151; Wu Y, 2016, ENV EARTH SCI, V75, P1, DOI DOI 10.1007/S12665-015-4915-; Wu YD, 2016, J ZHEJIANG UNIV-SC A, V17, P565, DOI 10.1631/jzus.A160023; Yu SY, 2013, INT J NAV ARCH OCEAN, V5, P598, DOI 10.2478/IJNAOE-2013-015",28,0,0,1,15,SAGE PUBLICATIONS LTD,LONDON,"1 OLIVERS YARD, 55 CITY ROAD, LONDON EC1Y 1SP, ENGLAND",0020-7209,2050-4578,,INT J ELEC ENG EDUC,Int. J. Elec. Eng. Educ.,,,,,,,,,,,20720919897553.0,10.1177/0020720919897553,,15,"Education, Scientific Disciplines; Engineering, Electrical & Electronic",Education & Educational Research; Engineering,KC2CD,WOS:000506991400001,,,,,2022-07-14,0.0038938563599653876,3.098881326402978e-10,0.007485757930858344,0.08874952003071804,0.007485757930858344
J,"Sheng, X1;  Lin, XC;  Deng, LJ;  Wu, ZY;  Chen, JY;  Liu, BY;  Zhong, ZC",,,,"Sheng, Xin; Lin, Xiaoci; Deng, Lijun; Wu, Zeying; Chen, Jiayi; Liu, Biyu; Zhong, Zuchang",,,Big data Markov chain model based dynamic evolution of regional gap-Take China's highway resources as an example,INTERNATIONAL JOURNAL OF ELECTRICAL ENGINEERING EDUCATION,,,English,Article; Early Access,,,,,,Big data; highway scale; regional gap; spatial imbalance; Dagum regional gap; distribution dynamics,,"Characterized by large scale, variety, fast generation, extremely high value but low density, big data can be used to mine effective information, provide users with auxiliary decision-making and realize its own value. The gap of traffic resources among different regions will affect the coordinated development of regional economy and widen the gap of wealth among regions. Under the background of emphasizing the coordinated development of regional economy in China, it is particularly important to study the allocation and utilization rate of highway resources in China. Based on the data of 31 provincial administrative regions from 2000 to 2014, this paper combines the Dagum Gini coefficient decomposition method with the extended distribution dynamics model to study the dynamic evolution of regional gap and distribution of highway scale from the perspective of quantity and quality. It is found that the gap of quality is more severe than that of quantity in China. The quality gap between East China and West China is the greatest, while the quantity gap is smaller, which indicates that China should pay attention to the utilization rate of highway resources while emphasizing the rational allocation, and check whether the supply of resources in the regions with busy and developed logistics services meets the demand while promoting economic growth by improving traffic accessibility.","[Sheng, Xin] Jiangsu Open Univ, Sch Business, Nanjing, Peoples R China; [Sheng, Xin] Guangzhou Panyu Polytech, Sch Management, Guangzhou, Peoples R China; [Lin, Xiaoci; Wu, Zeying; Chen, Jiayi; Liu, Biyu; Zhong, Zuchang] Guangdong Univ Foreign Studies, Sch Business, Guangzhou, Peoples R China; [Deng, Lijun] Fuzhou Univ, Sch Econ & Management, Fuzhou, Peoples R China","Deng, LJ (corresponding author), Fuzhou Univ, Sch Econ & Management, Fuzhou, Peoples R China.",dlj7425@163.com,,,National Natural Science Foundation of China [71673064]; Innovation team project (HUMANITIES AND SOCIAL SCIENCES) of universities in Guangdong [2017WCXTD003]; Philosophy and Social Sciences in Guangzhou [2018GZGJ194]; Yangcheng young scholars' Foundation [17QNXR12]; Social Sciences Planning Project of the Panyu Polytechnic [2016SK007],"The author(s) disclosed receipt of the following financial support for the research, authorship, and/or publication of this article: The research is supported by the National Natural Science Foundation of China (Grant: 71673064), Innovation team project (HUMANITIES AND SOCIAL SCIENCES) of universities in Guangdong (Grant: 2017WCXTD003), Philosophy and Social Sciences in Guangzhou (Grant: 2018GZGJ194), Yangcheng young scholars' Foundation (Grant: 17QNXR12), Social Sciences Planning Project of the Panyu Polytechnic (Grant: 2016SK007).","Chen F, 2015, ECON GEOGR, V35, P7; Li N, 2010, MODERNIZATION MANAGE, P1; Li YT, 2012, AREAL RES DEV, V31, P14; Li Z. Q., 2016, J YUNNAN U FINANCE E, V32, P5; Liang RH., 2015, CHINA MARKET, P7; Lin XB, 2016, ECON GEOGR, V36, P2; Liu HJ, 2017, INT J ELEC ENG EDUC, V54, P341, DOI 10.1177/002072091769465; Shen L, 2013, QUANTIT TECH EC, V30, P3; Zhou D., 2015, SHANGHAI J EC, V19, P2",9,2,2,8,19,SAGE PUBLICATIONS LTD,LONDON,"1 OLIVERS YARD, 55 CITY ROAD, LONDON EC1Y 1SP, ENGLAND",0020-7209,2050-4578,,INT J ELEC ENG EDUC,Int. J. Elec. Eng. Educ.,,,,,,,,,,,20720919884237.0,10.1177/0020720919884237,,16,"Education, Scientific Disciplines; Engineering, Electrical & Electronic",Education & Educational Research; Engineering,KB8YM,WOS:000506774100001,,,,,2022-07-14,0.0012979521199884625,2.941988954320779e-08,0.0023063055507053357,0.09285943861152775,0.0023063055507053357
