PT,AU,BA,BE,GP,AF,BF,CA,TI,SO,SE,BS,LA,DT,CT,CY,CL,SP,HO,DE,ID,AB,C1,RP,EM,RI,OI,FU,FX,CR,NR,TC,Z9,U1,U2,PU,PI,PA,SN,EI,BN,J9,JI,PD,PY,VL,IS,PN,SU,SI,MA,BP,EP,AR,DI,D2,PG,WC,SC,GA,UT,PM,OA,HC,HP,DA,DC,EC,LC,CC,BC
J,"Wang, C1;  Jiang, WJ;  Shi, X;  Zhang, HS",,,,"Wang, Chao; Jiang, Wenjian; Shi, Xin; Zhang, Huaisheng",,,"Detrital zircon age distribution characteristics of Jurassic sandstone from the Southern Yili basin, China",INTERNATIONAL JOURNAL OF ELECTRICAL ENGINEERING EDUCATION,,,English,Article; Early Access,,,,,,Yili basin; provenance analysis; zircon U-Pb geochronology; Jurassic,PALEOZOIC TECTONIC EVOLUTION; PERMIAN VOLCANIC-ROCKS; U-PB; WESTERN TIANSHAN; NW CHINA; OROGENIC BELT; GEOCHRONOLOGY; GEOCHEMISTRY; PETROGENESIS; CONSTRAINTS,"The Central Asia orogenic belt contains a wide range of structural elements, including micro continent, back arc system, ocean island/plateau, ophiolite and subduction accretion complex. But its final closing time has been controversial. Based on the magmatic age of the surrounding orogenic belt, the source of this set of clastic sediments is determined, which provides new important evidence for the evolution of the South Tianshan orogenic belt. The results show that the Jurassic detrital zircons from the study area were mainly derived from magmatic zircons and are deposited in a proximal source. The detrital zircon age of the Lower Jurassic Badaowan and Sangonghe Formation are concentrated in 290-260 Ma, and in 350-290 Ma and 460-390 Ma, respectively. The detrital zircon age of the Middle Jurassic Xishanyao Formation concentrates in 370-320 Ma and 450-390 Ma. There are very few zircons from the Precambrian period. These ages are consistent with the timing, indicating these clastic sediments were mainly originated from the southern margin of the Yili - Middle Tianshan Block. The Late Permian - Middle Triassic detrital zircons almost do not exist, implying that there were no contemporary magmatism related to collision or post-collision in the South Tianshan district, its complex evolution and orogenic stage are still a challenging topic. In the ancient active plate margin, the sedimentary records in the pre-arc basin can provide more information about the magmatic arc and basin-orogen coupling than the present exposed arc itself. The rhyolite, trachyte, and trachyandesite of the Dahalajunshan Formation were widely developed in the Yili - Middle Tianshan Block during the Early Carboniferous. During the formation of Wulang Formation in the Early Permian, a large number of rhyolite were developed. The age data of 75 detrital zircons were obtained from the sandstone (J1s-5) of the Sangonghe Formation, of which 74 zircons have a concordance degree of over 90%, and their age data also fall on the harmonic curv. In addition, the age of the youngest zircons increased gradually from Early to Middle Jurassic, indicating that the sediments in this period had the feature of uncovering. Our study provides a good reference for the analysis of provenance and regional tectonic evolution.","[Wang, Chao; Shi, Xin] Chengdu Univ Technol, Inst Sedimentary Geol, Chengdu, Peoples R China; [Wang, Chao; Shi, Xin] Chengdu Univ Technol, State Key Lab Oil & Gas Reservior Geol & Exploita, Chengdu, Peoples R China; [Wang, Chao] Sinopec Hua Bei Oilfield Serv Corp, Nanyang, Henan, Peoples R China; [Jiang, Wenjian; Zhang, Huaisheng] East China Univ Technol, State Key Lab Nucl Resources & Environm, Nanchang 330013, Jiangxi, Peoples R China","Jiang, WJ (corresponding author), East China Univ Technol, State Key Lab Nucl Resources & Environm, Nanchang 330013, Jiangxi, Peoples R China.",jiang2017@ecit.cn,,,State Key Laboratory of Nuclear Resources and Environment (East China University of Technology) [NRE 1804],"The author(s) disclosed receipt of the following financial support for the research, authorship, and/or publication of this article: This study was supported by the Open Fund(NRE 1804) of State Key Laboratory of Nuclear Resources and Environment (East China University of Technology).","An F, 2017, GONDWANA RES, V43, P41, DOI 10.1016/j.gr.2015.11.01; [白建科 Bai Jianke], 2015, [地质论评, Geological Review], V61, P19; Bhattacharya JP, 2016, EARTH-SCI REV, V153, P77, DOI 10.1016/j.earscirev.2015.10.01; Charvet J, 2011, SCI CHINA EARTH SCI, V54, P166, DOI 10.1007/s11430-010-4138-; Dickinson WR, 2000, GEOL S AM S, P15; Forcan M, 2018, INT J ELEC ENG EDUC, V55, P14, DOI 10.1177/002072091775095; Gao J, 2009, INT J EARTH SCI, V98, P1221, DOI 10.1007/s00531-008-0370-; Ge RF, 2014, TECTONICS, V33, P302, DOI 10.1002/2013TC00350; Ge RF, 2012, LITHOS, V142, P1, DOI 10.1016/j.lithos.2012.02.01; Gluskin E, 1996, INT J ELEC ENG EDUC, V33, P195, DOI 10.1177/00207209960330030; Gou LL, 2016, J ASIAN EARTH SCI, V115, P40, DOI 10.1016/j.jseaes.2015.09.02; Gu CC, 2018, GONDWANA RES, V60, P194, DOI 10.1016/j.gr.2018.04.01; Han BF, 2011, EARTH-SCI REV, V109, P74, DOI 10.1016/j.earscirev.2011.09.00; Han BF, 2010, GEOL SOC AM BULL, V122, P627, DOI 10.1130/B26491.; Han XZ, 2008, ACTA PETROL SIN, V24, P244; Han YG, 2018, EARTH-SCI REV, V186, P129, DOI 10.1016/j.earscirev.2017.09.01; Han YG, 2016, LITHOS, V246, P1, DOI 10.1016/j.lithos.2015.12.01; He ZY, 2018, EARTH-SCI REV, V185, P1, DOI 10.1016/j.earscirev.2018.05.01; [侯明才 Hou Mingcai], 2016, [地质学报, Acta Geologica Sinica], V90, P333; Huang H, 2015, LITHOS, V228, P23, DOI 10.1016/j.lithos.2015.04.01; Huang H, 2018, GEOL SOC AM BULL, V130, P952, DOI 10.1130/B31588.; IPSON SS, 1991, INT J ELEC ENG EDUC, V28, P322, DOI 10.1177/00207209910280040; Jiang CY, 1993, ACTA PETROLOGICA MIN, V12, P22; Jiang T, 2014, TECTONOPHYSICS, V612, P106, DOI 10.1016/j.tecto.2013.11.03; Jiang W., 2018, J E CHINA U SCI TECH, V41, P30; Kroner A, 2013, GONDWANA RES, V23, P272, DOI 10.1016/j.gr.2012.05.00; Li D, 2015, J ASIAN EARTH SCI, V113, P728, DOI 10.1016/j.jseaes.2015.09.00; [李鸿 Li Hong], 2011, [新疆地质, Xinjiang Geology], V29, P38; [李继磊 LI Ji-lei], 2009, [地质通报, Geological Bulletin of China], V28, P185; Liu DD, 2014, INT J EARTH SCI, V103, P737, DOI 10.1007/s00531-013-0994-; Liu YS, 2010, J PETROL, V51, P537, DOI 10.1093/petrology/egp08; Long LL, 2006, ACTA PETROL SIN, V22, P6; [马中平 MA Zhongping], 2007, [西北大学学报. 自然科学版, Journal of Northwest University. Natural Science Edition], V37, P10; Mei YH, 2019, GEOL J, V54, P1081, DOI 10.1002/gj.342; POLDERVAART A, 1956, AM J SCI, V254, P521, DOI 10.2475/ajs.254.9.52; Qian XY, 2015, ACTA PETROL SIN, V31, P131; [茹艳娇 Ru Yanjiao], 2012, [地质通报, Geological Bulletin of China], V31, P5; Rubatto D, 2002, CHEM GEOL, V184, P123, DOI 10.1016/S0009-2541(01)00355-; Tang GJ, 2014, LITHOS, V202, P85, DOI 10.1016/j.lithos.2014.04.01; Wang B, 2008, B SOC GEOL FR, V179, P483, DOI 10.2113/gssgfbull.179.5.48; WANG XC, 1995, J HEBEI COLL GEOLOGY, V18, P29; WATSON EB, 1983, EARTH PLANET SC LETT, V64, P295, DOI 10.1016/0012-821X(83)90211-; Windley BF, 2007, J GEOL SOC LONDON, V164, P31, DOI 10.1144/0016-76492006-02; Wu MH, 2017, INT J ELEC ENG EDUC, V54, P262, DOI 10.1177/002072091668157; Xia LQ, 2008, J ASIAN EARTH SCI, V31, P357, DOI 10.1016/j.jseaes.2007.07.00; Xia LQ, 2012, GEOSCI FRONT, V3, P445, DOI 10.1016/j.gsf.2011.12.01; Xiao WJ, 2009, INT J EARTH SCI, V98, P1189, DOI 10.1007/s00531-008-0407-; Xiao WJ, 2018, EARTH-SCI REV, V186, P94, DOI 10.1016/j.earscirev.2017.09.02; Xiao WJ, 2015, ANNU REV EARTH PL SC, V43, P477, DOI [10.1146/annurev-earth-060614-1052, 10.1146/annurev-earth-060614-105254; Xiao WJ, 2013, GONDWANA RES, V23, P1316, DOI 10.1016/j.gr.2012.01.01; Xu XY, 2013, J ASIAN EARTH SCI, V72, P33, DOI 10.1016/j.jseaes.2012.11.02; Yakubchuk A, 2017, GONDWANA RES, V47, P372, DOI 10.1016/j.gr.2016.12.01; Yang GX, 2011, J ASIAN EARTH SCI, V40, P722, DOI 10.1016/j.jseaes.2010.11.00; Yu XQ, 2016, INT J EARTH SCI, V105, P1637, DOI 10.1007/s00531-015-1275-; Yuan WM, 2020, ORE GEOL REV, V119, DOI 10.1016/j.oregeorev.2020.10338; Zhan G.-W., 1999, EARTH SCI FRONT, V6, P20; Zhang C, 2019, GONDWANA RES, V76, P146, DOI 10.1016/j.gr.2019.06.00; Zhang LF, 2007, LITHOS, V96, P266, DOI 10.1016/j.lithos.2006.09.01; Zhang W, 2015, INT GEOL REV, V57, P1975, DOI 10.1080/00206814.2015.104594; Zhang XY, 2015, ACTA PETROL SIN, V31, P27; Zhou JB, 2018, EARTH-SCI REV, V186, P76, DOI 10.1016/j.earscirev.2017.01.01; Zhu YF, 2009, J GEOL SOC LONDON, V166, P1085, DOI 10.1144/0016-76492008-13; Zong KQ, 2017, PRECAMBRIAN RES, V290, P32, DOI 10.1016/j.precamres.2016.12.01",63,0,0,3,7,SAGE PUBLICATIONS LTD,LONDON,"1 OLIVERS YARD, 55 CITY ROAD, LONDON EC1Y 1SP, ENGLAND",0020-7209,2050-4578,,INT J ELEC ENG EDUC,Int. J. Elec. Eng. Educ.,,,,,,,,,,,20720920940603.0,10.1177/0020720920940603,,13,"Education, Scientific Disciplines; Engineering, Electrical & Electronic",Education & Educational Research; Engineering,MS8NS,WOS:000554531000001,,,,,2022-07-14,0.009085664839919239,6.721667495154433e-08,0.017804224546361606,0.09755205402363534,0.017804224546361606
J,"Shi, Y21",,,,"Shi, Yin",,,Teaching application of watercolor light color technique,INTERNATIONAL JOURNAL OF ELECTRICAL ENGINEERING EDUCATION,,,English,Article; Early Access,,,,,,Watercolor; techniques; teaching; exploration,,"As a branch of watercolor painting, watercolor light color has been widely used in different fields. In the field of design, designers use the convenience, quickness, transparency and brilliance of watercolor to draw a design drawing. In the field of art creation, watercolor is usually the best choice for painters to go out to sketch and create large-scale drawings. In the field of art education, watercolor tools are easy to carry, low-cost and easy to operate, which can facilitate students' repeated practice and outside Sketching is helpful to cultivate students' sense of color and observation ability. Therefore, as a branch of art curriculum, watercolor light color has a wide range of uses and great practicability, which is worth exploring and studying.","[Shi, Yin] Maanshan Normal Coll, Dept Educ & Teachers, Maanshan 243000, Peoples R China","Shi, Y (corresponding author), Maanshan Normal Coll, Dept Educ & Teachers, Maanshan 243000, Peoples R China.",2250833904@qq.com,,,quality engineering school enterprise cooperation practical education base project in Anhui Province: practice education base of Ma'anshan teachers college teacher art culture and art company [2016sjjd072],"The author(s) disclosed receipt of the following financial support for the research, authorship, and/or publication of this article: 2016 quality engineering school enterprise cooperation practical education base project in Anhui Province: practice education base of Ma'anshan teachers college teacher art culture and art company, Project No.: 2016sjjd072.","Aimin Wang, 2010, 2010 International Conference on E-Health Networking, Digital Ecosystems and Technologies (EDT 2010), P506, DOI 10.1109/EDT.2010.549644; Bongiorno L., 2014, TEACHING YOUNG CHILD, V7, P12; DAVIS JW, 1984, LEONARDO, V17, P66, DOI 10.2307/157489; Hu Y, 2011, J HIGHER ED RES, V2, P3; LeBoeuf RL, 2018, INT J ELEC ENG EDUC, V55, P155, DOI 10.1177/002072091875625; Oncel AF, 2019, INT J ELEC ENG EDUC, V56, P208, DOI 10.1177/002072091878871; Orji CT, 2018, INT J ELEC ENG EDUC, V55, P334, DOI 10.1177/002072091877398; Perotoni MB, 2019, INT J ELEC ENG EDUC, V56, P193, DOI 10.1177/002072091879009; Reid J, 2017, TOBACCO USE CANADA ; Schultz L., 2014, SCH ARTS, V84, P1; Tomohiro S, 2009, CISIS: 2009 INTERNATIONAL CONFERENCE ON COMPLEX, INTELLIGENT AND SOFTWARE INTENSIVE SYSTEMS, VOLS 1 AND 2, P1024, DOI 10.1109/CISIS.2009.10; Wu J., 2011, J HIGHER ED RES, V21, P2",12,0,0,5,14,SAGE PUBLICATIONS LTD,LONDON,"1 OLIVERS YARD, 55 CITY ROAD, LONDON EC1Y 1SP, ENGLAND",0020-7209,2050-4578,,INT J ELEC ENG EDUC,Int. J. Elec. Eng. Educ.,,,,,,,,,,,20720920936830.0,10.1177/0020720920936830,,9,"Education, Scientific Disciplines; Engineering, Electrical & Electronic",Education & Educational Research; Engineering,MW5PA,WOS:000557087300001,,,,,2022-07-14,0.0017306028266512834,0.0003679608034417364,0.047450023713684425,0.1437932893699971,0.04887995075736914
J,"Chen, L1;  Han, W;  Li, HT;  Xu, ZK;  Zhang, JW;  Cao, X",,,,"Chen, Ling; Han, Wei; Li, Hai-Tao; Xu, Zi-Kun; Zhang, Jing-Wei; Cao, Xiang",,,Long distance wireless fault diagnosis for photovoltaic modules based on back propagation neural network,INTERNATIONAL JOURNAL OF ELECTRICAL ENGINEERING EDUCATION,,,English,Article; Early Access,,,,,,Photovoltaic modules; fault diagnosis; back propagation neural network; Levenberg-Marquardt algorithm; Zigbee technology,SYSTEMS; ALGORITHM,"Various faults of photovoltaic (PV) modules inevitably occur in the work process, since PV modules are installed in hostile situation. To obtain the types of failure, a novel fault diagnosis method based on back propagation (BP) neural network with Levenberg-Marquardt (L-M) algorithm for PV modules is proposed. Through the in-depth analysis the output of PV modules under normal and fault conditions, the input variables of the diagnosis model are acquired. The high-speed and real-time fault diagnosis model for PV modules is first designed based on TMS320VC5402 DSP and long-distance wireless fault diagnosis is realized by Zigbee technology. The simulation and experimental results show that the fault diagnosis method for PV modules based on BP network with L-M algorithm can effectively detect four types of fault for PV modules such as open circuit, short circuit, partial shading and abnormal degradation. The numerical results verify the effectiveness and correctness of the proposed method, which can provide a great educational benefit of PV operation technology.","[Chen, Ling; Cao, Xiang] Huaiyin Normal Univ, Sch Phys & Elect Elect Engn, Huaian, Peoples R China; [Han, Wei; Li, Hai-Tao; Xu, Zi-Kun] State Grid Jiangsu Elect Power Co Ltd, Huaian 223001, Peoples R China; [Zhang, Jing-Wei] Hohai Univ, Coll Mech & Elect Engn, Changzhou, Jiangsu, Peoples R China","Han, W (corresponding author), State Grid Jiangsu Elect Power Co Ltd, Huaian 223001, Peoples R China.",carolcl1987@126.com,,,Natural Science Research Program of Huai'an City [HAB201831],"The author(s) disclosed receipt of the following financial support for the research, authorship, and/or publication of this article: The authors acknowledge the Natural Science Research Program of Huai'an City (Grant: HAB201831).","Appiah AY, 2019, IEEE ACCESS, V7, P30089, DOI 10.1109/ACCESS.2019.290294; Belaout A, 2018, RENEW ENERG, V127, P548, DOI 10.1016/j.renene.2018.05.00; Blaifi S, 2018, ELECTR ENG, V100, P1021, DOI 10.1007/s00202-017-0567-; Chen LA, 2018, IEEE T SMART GRID, V9, P1835, DOI 10.1109/TSG.2016.260108; Dhimish M, 2017, ENERGY, V140, P276, DOI 10.1016/j.energy.2017.08.10; Dhimish M, 2017, HIGH VOLT, V2, P244, DOI 10.1049/hve.2017.004; Harrou F, 2018, RENEW ENERG, V116, P22, DOI 10.1016/j.renene.2017.09.04; Huang JM, 2019, IEEE ACCESS, V7, P70919, DOI 10.1109/ACCESS.2019.291933; Kamath HG, 2019, IEEE J PHOTOVOLT, V9, P424, DOI 10.1109/JPHOTOV.2018.288362; Kumar BP, 2018, IEEE J PHOTOVOLT, V8, P257, DOI 10.1109/JPHOTOV.2017.277015; Madeti SR, 2017, SOL ENERGY, V158, P161, DOI 10.1016/j.solener.2017.08.06; Mansouri M, 2018, ENERGY, V159, P842, DOI 10.1016/j.energy.2018.06.19; Martin C, 2020, ENERG CONVERS MANAGE, V210, P11271; Mellit A, 2018, RENEW SUST ENERG REV, V91, P1, DOI 10.1016/j.rser.2018.03.06; Triki-Lahiani A, 2018, RENEW SUST ENERG REV, V82, P2680, DOI 10.1016/j.rser.2017.09.10; Zarkovic MD, 2015, INT J ELEC ENG EDUC, V52, P81, DOI 10.1177/002072091557054; Zhang C, 2008, NEUROCOMPUTING, V72, P513, DOI 10.1016/j.neucom.2007.12.00; Zhang KF, 2016, ARAB J SCI ENG, V41, P3451, DOI 10.1007/s13369-015-2001-; Zhang WB, 2019, IEEE ACCESS, V7, P11736, DOI 10.1109/ACCESS.2019.289272; Zhao ZZ, 2016, NEURAL COMPUT APPL, V27, P375, DOI 10.1007/s00521-015-1850-; Zhu HL, 2018, SOL ENERGY, V176, P395, DOI 10.1016/j.solener.2018.10.05; Zimny J, 2018, INT J ELEC ENG EDUC, V55, P142, DOI 10.1177/002072091775095",22,2,2,1,17,SAGE PUBLICATIONS LTD,LONDON,"1 OLIVERS YARD, 55 CITY ROAD, LONDON EC1Y 1SP, ENGLAND",0020-7209,2050-4578,,INT J ELEC ENG EDUC,Int. J. Elec. Eng. Educ.,,,,,,,,,,,20720920940601.0,10.1177/0020720920940601,,21,"Education, Scientific Disciplines; Engineering, Electrical & Electronic",Education & Educational Research; Engineering,MN9MV,WOS:000551164700001,,,,,2022-07-14,0.003172771848860686,3.4868096056323933e-06,0.016062014474442863,0.10666379522520306,0.016062014474442863
J,"Xiao, M21;   Yi, HB",,,,"Xiao, Meng; Yi, Haibo",,,A practical and efficient multi-assessment system for vocational teaching based on machine learning,INTERNATIONAL JOURNAL OF ELECTRICAL ENGINEERING EDUCATION,,,English,Article; Early Access,,,,,,Multi-assessment system; vocational teaching; machine learning; higher vocational education; teaching assessment,EDUCATION,"Higher vocational education is a self-consistent system for higher education appropriate to the development of productivity and economy in the world. It aims at training skilled talents, which has made great contribution to the economy and industry. Generally, designing courses in high vocational education includes teaching analysis, teaching strategy, teaching practice and teaching assessment. Among the teaching steps, teaching assessment is one of the most important method to improve the quality of course teaching. However, in most high vocational education courses, traditional written exam is still the primary tools of assessments, which can not fulfill the development of high vocational education. In order to improve the quality of high vocational education, it is very urgent to design a practical and efficient system with multiple assessments. We exploit machine learning techniques to design assessment system for high vocation education. Machine learning is a very powerful tool for data analysis and it has been used for education tools in recent years. First, we improve the teaching organization for training skilled talents. Second, we propose a feature selection model based on the improved teaching organization. Third, we propose a machine learning model for teaching assessment. With the main contributions and other improvements, we design a multi-assessment system for vocational teaching based on machine learning. We implement the multi-assessment system by using Python and TensorFlow, which shows that the system can provide practical and efficient multiple assessments for vocational teaching based on training machine learning model. Compared with other assessment methods, machine learning based multi-assessment is more intelligent and automatic. Besides, it can be extended to other fields of education with slight modifications.","[Xiao, Meng] Shenzhen Polytech, Sch Management, Shenzhen, Peoples R China; [Yi, Haibo] Shenzhen Polytech, Sch Artificial Intelligence, Shenzhen 518055, Peoples R China","Yi, HB (corresponding author), Shenzhen Polytech, Sch Artificial Intelligence, Shenzhen 518055, Peoples R China.",haiboyi@szpt.edu.cn,,,"Natural Science Foundation of Guangdong Province, China [2018A030310030]; Foundation for Distinguished Young Talents in Higher Education of Guangdong, China [2017GkQNCX059]; Teaching Research and Practice Project of Guangdong Province, China [GDJG2019403]; Special funds for Shenzhen Strategic Emerging Industries and Future Industrial Development [20170502142224600]; Teaching Research and Practice Project of Shenzhen Polytechnic [7019310019J]","The author(s) disclosed receipt of the following financial support for the research, authorship, and/or publication of this article: The authors acknowledge Natural Science Foundation of Guangdong Province, China (Grant no. 2018A030310030), Foundation for Distinguished Young Talents in Higher Education of Guangdong, China (Grant no. 2017GkQNCX059), Teaching Research and Practice Project of Guangdong Province, China (Grant no. GDJG2019403), Special funds for Shenzhen Strategic Emerging Industries and Future Industrial Development (Grant no. 20170502142224600), Teaching Research and Practice Project of Shenzhen Polytechnic (Grant no. 7019310019J).","Alharbi F, 2020, INT J ELEC ENG EDUC, DOI 10.1177/002072092090342; Carifio J, 2017, J HIGH ENERGY PHYS, DOI 10.1007/JHEP09(2017)15; Carpenter SK, 2017, CBE-LIFE SCI EDUC, V16, DOI 10.1187/cbe.16-06-020; Chan TM, 2017, CAN J EMERG MED, V19, pS9, DOI 10.1017/cem.2017.3; Chankseliani M, 2016, BRIT EDUC RES J, V42, P582, DOI 10.1002/berj.321; Dawes TJW, 2017, RADIOLOGY, V283, P381, DOI 10.1148/radiol.201616131; Deissinger T., 1997, EDUC TRAIN, V39, P297, DOI [10.1108/00400919710190090, DOI 10.1108/00400919710190090; Goodfellow I, 2018, COMMUN ACM, V61, P56, DOI 10.1145/313459; Hagenauer J, 2017, EXPERT SYST APPL, V78, P273, DOI 10.1016/j.eswa.2017.01.05; Hanushek EA, 2017, J HUM RESOUR, V52, P48, DOI 10.3368/jhr.52.1.0415-7074; Heitkamp SJ, 2018, BMC MED EDUC, V18, DOI 10.1186/s12909-018-1220-; Hooge E, 2015, EUR J EDUC, V50, P478, DOI 10.1111/ejed.1215; Huang J, 2000, J CONTROL RELEASE, V67, P45, DOI 10.1016/S0168-3659(00)00196-; Jarmon L, 2009, COMPUT EDUC, V53, P169, DOI 10.1016/j.compedu.2009.01.01; Khubalkar S, 2020, INT J ELEC ENG EDUC, V57, P3, DOI 10.1177/002072091879950; Kumar DS, 2020, INT J ELEC ENG EDUC, DOI 10.1177/002072091989419; Kutscha, 2002, CEDEFOP, P5; Mei J., INT J TECHNOL MANAG, V4, P; Min D., INT J TECHNOL MANAG, V1, P4; Moore C, 2016, ADV HEALTH SCI EDUC, V21, P121, DOI 10.1007/s10459-015-9618-; Olafsdottir OA, 2018, MIDWIFERY, V62, P104, DOI 10.1016/j.midw.2018.03.02; OWEN SG, 1965, POSTGRAD MED J, V41, P201, DOI 10.1136/pgmj.41.474.20; Rintala H, 2020, VOCAT LEARN, V13, P113, DOI 10.1007/s12186-019-09229-; Schoen RC, 2017, ELEM SCHOOL J, V118, P55, DOI 10.1086/69291; Skedsmo G, 2019, EDUC ASSESS EVAL ACC, V31, P1, DOI 10.1007/s11092-019-09294-; Wang P, 2019, ACM COMPUT SURV, V51, DOI 10.1145/321430; Zhou M, 2018, AM J NEURORADIOL, V39, P208, DOI 10.3174/ajnr.A539",27,1,1,10,34,SAGE PUBLICATIONS LTD,LONDON,"1 OLIVERS YARD, 55 CITY ROAD, LONDON EC1Y 1SP, ENGLAND",0020-7209,2050-4578,,INT J ELEC ENG EDUC,Int. J. Elec. Eng. Educ.,,,,,,,,,,,20720920940573.0,10.1177/0020720920940573,,13,"Education, Scientific Disciplines; Engineering, Electrical & Electronic",Education & Educational Research; Engineering,MN3RH,WOS:000550761200001,,,,,2022-07-14,0.0038938563599653876,1.6450709674104674e-07,0.014608676443929774,0.10437426618899961,0.01430666788899962
J,"Xin, B1",,,,"Xin, Bian",,,Landscape interaction design of special education school based on children's perceptual disturbance,INTERNATIONAL JOURNAL OF ELECTRICAL ENGINEERING EDUCATION,,,English,Article; Early Access,,,,,,Special education school; perceptual disturbance; special children; landscape interaction design,,"With the continuous development of the career of the disabled, special education has become an important part of the development of education in China. Therefore, it is particularly important to meet the needs of special children's campus construction. However, China is relatively backward, and special education schools lack complete landscape design for special groups. Campus landscape carries many contents including education, leisure, communication and rehabilitation. At present, the landscape design of special education schools lacks the recognition of the particularity of special children, and ignores their demands for normal communication and interaction. Starting from the characteristics of special children, this paper analyses and studies the perceptual characteristics of hearing impaired students and visual impaired students respectively, and applies the concept of interactive design to the landscape design of special schools. Interaction design pays attention to the process of human experience, which coincides with the design idea of people-oriented emphasized in landscape design. Landscape interaction design is the design of human communication, communication and interaction space, so as to guide the campus landscape environment suitable for the barrier-free interaction of actors, make up for defects, provide safe activities, individualized education and living campus.","[Xin, Bian] Shandong Womens Univ, Inst Art & Design, Jinan 250300, Peoples R China","Xin, B (corresponding author), Shandong Womens Univ, Inst Art & Design, Jinan 250300, Peoples R China.",29065@sdwu.edu.cn,,,,,"Chen BQ., 2012, CHINA SCI ED INNOV G, V8, P1; Gang S., 2013, DIGITAL TECHNOLOGY L, V1, P8; Jiang XN., 2012, SOCIAL WELFARE THEOR, V9, P3; Kang R, 2019, INT J ELEC ENG EDUC, V56, P179, DOI 10.1177/002072091879558; Loosvelt H, 2007, INT J ELEC ENG EDUC, V44, P146, DOI 10.7227/IJEEE.44.2.; Loreto-Gomez G, 2019, INT J ELEC ENG EDUC, V56, P163, DOI 10.1177/002072091879011; Muderrisoglu H, 2013, INDOOR BUILT ENVIRON, V24, P34; Wang FR., 2003, SICHUAN ARCHITECT SC, V29, P9; Zhang Y and, 2013, HUAZHONG ARCHITECT, V1, P6; Zhang YZ, 2016, J ARCHITECT, V3, P10",10,0,0,10,37,SAGE PUBLICATIONS LTD,LONDON,"1 OLIVERS YARD, 55 CITY ROAD, LONDON EC1Y 1SP, ENGLAND",0020-7209,2050-4578,,INT J ELEC ENG EDUC,Int. J. Elec. Eng. Educ.,,,,,,,,,,,20720920940598.0,10.1177/0020720920940598,,12,"Education, Scientific Disciplines; Engineering, Electrical & Electronic",Education & Educational Research; Engineering,MM2DP,WOS:000549968000001,,,,,2022-07-14,0.0014421690222094028,5.073210189943156e-06,0.0043135512370967135,0.12572070928672444,0.004700254896520357
